Clear Image Technology,https://www.crunchbase.com/organization/clear-image-technology,"Biotechnology, Health Care, Information Technology","Elyria, Ohio, United States",Clear Image Technology develops diagnostic scope systems for healthcare providers.,,(440)336-4330,http://www.clearimg.com,For Profit,1,Seed,"$500,000",2012-08-20,Seed,"$500,000","Biotechnology, Health Care, Information Technology, Science and Engineering",Private
DNALite Therapeutics,https://www.crunchbase.com/organization/dnalite-therapeutics,"Biotechnology, Genetics, Health Care","San Francisco, California, United States","DNALite Therapeutics, Inc. is an early-stage preclinical biotechnology company.",,,http://www.dnalite.com/,For Profit,2,Seed,,2017-12-22,Seed,,"Biotechnology, Health Care, Science and Engineering",Private
MDconnectME,https://www.crunchbase.com/organization/mdconnectme,"Biotechnology, Health Care, Pharmaceutical","Philadelphia, Pennsylvania, United States",MDconnectME enables surgical staff to seamlessly and securely communicate with concerned patient-families from the point-of-care.,info@MDconnectME.com,877.717.MDME,http://corp.mdconnectme.com,,1,Seed,"$50,000",2011-05-31,Seed,"$50,000","Biotechnology, Health Care, Science and Engineering",Private
ViruCure Therapeutics ,https://www.crunchbase.com/organization/virucure-therapeutics,Biotechnology,,ViruCure is biotech company developing an oncolytic-virus-based technology platform for the treatment of cancer.,info@Virucure.com,,http://www.virucure.com,For Profit,1,Seed,,2017-01-01,Seed,,"Biotechnology, Science and Engineering",Private
DestiNA Genomics,https://www.crunchbase.com/organization/destina-genomics,"Biotechnology, Genetics","Edinburgh, Edinburgh, City of, United Kingdom","We aim to transform how miRNAs are detected, providing simpler tools for health care and drug development professionals.",info@destinagenomics.com,+44 (0)162 082 2611,https://destinagenomics.com/,For Profit,1,Seed,"€1,200,000",2014-10-02,Seed,"€1,200,000","Biotechnology, Health Care, Science and Engineering",Private
Bioparaiso,https://www.crunchbase.com/organization/bioparaiso,Biotechnology,"Santiago, Region Metropolitana, Chile",Bioparaiso ia developing an accelerator program that will enable promising entrepreneurs in the fields of applied biology.,guido@bioparaiso.com,,http://bioparaiso.com,,1,Seed,"$40,000",2012-07-18,Seed,"$40,000","Biotechnology, Science and Engineering",Private
PCI Pharma Services,https://www.crunchbase.com/organization/pci-pharma-services,"Biotechnology, Health Care, Life Science, Medical Device, Pharmaceutical","Philadelphia, Pennsylvania, United States",PCI Pharma Services is a provider of outsourced services to the global pharmaceutical market.,sales@pciservices.com,(215)613-3600,http://www.pciservices.com,For Profit,1,M&A,,2014-08-10,Seed,,"Biotechnology, Health Care, Science and Engineering",Private
Green Biofactory,https://www.crunchbase.com/organization/green-biofactory,Biotechnology,"La Reina, Region Metropolitana, Chile","Green Biofactory produce biological compounds in microalgaes. In particular, we are interested in the synthesis of recombinant proteins",contacto@gbf.cl,,http://www.greenbiofactory.cl,,1,Seed,"$40,000",2013-07-25,Seed,"$40,000","Biotechnology, Science and Engineering",Private
Direct Spinal Therapeutics,https://www.crunchbase.com/organization/direct-spinal-therapeutics,"Biotechnology, Medical, Therapeutics","Charlottesville, Virginia, United States","Direct Spinal Therapeutics operates in the healthcare industry, focusing on biotechnology-related businesses.",,,,,1,Seed,"$1,000,000",2013-09-10,Seed,"$1,000,000","Biotechnology, Health Care, Science and Engineering",Private
Egoscue,https://www.crunchbase.com/organization/egoscue,"Biotechnology, Health Care, Health Diagnostics","San Diego, California, United States",Egoscue is a biotechnology company that develops natural non-medical pain relief solutions for patients.,admin@egoscue.com,18587926038,http://egoscue.com,For Profit,2,Seed,"$7,000",2013-05-09,Seed,"$12,550","Biotechnology, Health Care, Science and Engineering",Private
Eden Therapeutics,https://www.crunchbase.com/organization/eden-therapeutics,"Biotechnology, Medical, Therapeutics","Houston, Texas, United States","Eden Therapeutics is based in Houston, Texas.",,281-802-4776,http://edentherapy.com,,1,Seed,"$1,000,000",2011-11-30,Seed,"$1,000,000","Biotechnology, Health Care, Science and Engineering",Private
Performance Genomics,https://www.crunchbase.com/organization/performance-genomics,"Biotechnology, Genetics, Health Care",,PG develops DNA sequence-based predictive algorithms or genome apps to guide livestock breeding and assess human reproductive health.,mdennis@performancegenomics.ca,902-896-7230,http://www.performancegenomics.ca,,1,Seed,"CA$250,000",2013-09-09,Seed,"CA$250,000","Biotechnology, Health Care, Science and Engineering",Private
HyperStealth Biotechnology,https://www.crunchbase.com/organization/hyperstealth-biotechnology,"Biotechnology, Dietary Supplements, Medical Device","Maple Ridge, British Columbia, Canada","HyperStealth Biotechnology develops military camouflage technology used in uniforms, vehicles, hunting tools, and stealth activities.",info@hyperstealth.com,(604)961-7046,http://hyperstealth.com,For Profit,1,Seed,"$19,654",2013-06-26,Seed,"$19,654","Biotechnology, Food and Beverage, Health Care, Science and Engineering",Private
FlowCo,https://www.crunchbase.com/organization/flowco,"Biotechnology, Medical Device","Indianapolis, Indiana, United States",FlowCo is a medical device company developing products to improve the flow of blood through the vascular system.,,(317)377-0300,,For Profit,3,Seed,"$2,000,000",2010-04-24,Seed,"$3,450,000","Biotechnology, Health Care, Science and Engineering",Private
Therasport Physical Therapy,https://www.crunchbase.com/organization/therasport-physical-therapy,"Biotechnology, Health Care, Medical","Visalia, California, United States",Therasport Physical Therapy provides services to treat orthopedic and neurological conditions.,info@therasport.org,+856 8562568393,http://www.therasport.org,,1,Seed,"$50,000",2012-10-09,Seed,"$50,000","Biotechnology, Health Care, Science and Engineering",Private
Ascalon International,https://www.crunchbase.com/organization/ascalon-international,"Biotechnology, Health Diagnostics, Medical","Scottsdale, Arizona, United States",Ascalon International is an oncology drug development company that creates and manages a portfolio of oncology drugs.,,,,,2,Seed,"$100,000",2011-12-08,Seed,"$905,300","Biotechnology, Health Care, Science and Engineering",Private
Lince Labs - Amniofilm,https://www.crunchbase.com/organization/lince-labs-amniofilm,Biotechnology,"Santiago, Region Metropolitana, Chile","Lince Labs - Amniofilm is a biotechnology eye center, which integrates scientific research to everyday practice of medicine.",contacto@lincelabs.com,+56 2 2580 2292,http://lincelabs.cl,For Profit,1,Seed,"$40,000",2012-08-22,Seed,"$40,000","Biotechnology, Science and Engineering",Private
VitroLabs,https://www.crunchbase.com/organization/vitrolabs,"3D Technology, Biotechnology","San Francisco, California, United States",VitroLabs is a startup working on the cutting edge of 3D tissue engineering using stem cell-based technologies. ,info@vitrolabsinc.com,,http://www.vitrolabsinc.com/,,1,Seed,,2017-01-01,Seed,,"Biotechnology, Hardware, Science and Engineering, Software",Private
NGTronix Industries,https://www.crunchbase.com/organization/ngtronix-industries,Biotechnology,"Toronto, Ontario, Canada","Their mission is to develop cutting edge biomedical sensors that enhance fitness, athletics and healthcare.",preet@ngtronix.ca,,http://ngtronix.ca/,For Profit,1,Seed,"$30,000",2015-03-01,Seed,"$30,000","Biotechnology, Science and Engineering",Private
Lingrove,https://www.crunchbase.com/organization/lingrove,"Biotechnology, Industrial Engineering, Mechanical Engineering","San Francisco, California, United States",Lingrove is a materials and design firm focused on plant based fibers and resins. ,,415 671-8191,https://lingrove.com/,For Profit,1,Seed,,2018-01-24,Seed,,"Biotechnology, Manufacturing, Science and Engineering",Private
Epona Biotech,https://www.crunchbase.com/organization/epona-biotech-2,"Alumni, Biotechnology, Health Care, Medical","Sligo, Sligo, Ireland",A high-value animal health monitoring system for early detection of disease and illness.,info@eponabiotech.com,,,For Profit,1,Seed,"$12,500",2015-08-01,Seed,"$12,500","Biotechnology, Health Care, Science and Engineering",Private
BioNascent,https://www.crunchbase.com/organization/bionascent,"Biotechnology, Information Services, News","San Francisco, California, United States",BioNascent is determined to close the gap between the health outcomes of breastfed and formula fed infants.,contact@bionascent.co,510.407.6775,http://bionascent.co/,For Profit,1,Seed,,2016-03-03,Seed,,"Biotechnology, Content and Publishing, Information Technology, Media and Entertainment, Science and Engineering",Private
JuroJinX,https://www.crunchbase.com/organization/jurojinx-ag,"Biotechnology, Diabetes, Health Care","Zug, Zug, Switzerland","JuroJinX has developed innovative technologies for food applications to reduce the risk of exposure to Obesity, Alzheimer and Diabetes II.",,,http://www.jurojinx.ch/,For Profit,1,Seed,"$100,000",2015-08-03,Seed,"$100,000","Biotechnology, Health Care, Science and Engineering",Private
RegDesk,https://www.crunchbase.com/organization/regdesk,"Biotechnology, Consulting, Health Care, mHealth","Philadelphia, Pennsylvania, United States",Bringing Speed and Certainty to Life Sciences,,267-607-3375,http://www.regdesk.co,For Profit,1,Seed,,2014-10-24,Seed,,"Biotechnology, Health Care, Mobile, Science and Engineering",Private
K94 Discoveries,https://www.crunchbase.com/organization/k94-discoveries,Biotechnology,"Baton Rouge, Louisiana, United States",K94 Discoveries is a biotechnology company developing anti-cancer drugs.,,,,For Profit,1,Seed,"$300,000",2013-09-24,Seed,"$300,000","Biotechnology, Science and Engineering",Private
"Onconetics Pharmaceuticals, Inc.",https://www.crunchbase.com/organization/onconetics-pharmaceuticals-inc,"Biotechnology, Medical, Pharmaceutical","San Francisco, California, United States",Onconetics Pharmaceuticals develops personalized gene therapies for cancers and other genetic disorders.,,,http://www.onconetics.com,For Profit,1,Seed,,2017-10-05,Seed,,"Biotechnology, Health Care, Science and Engineering",Private
Projectioneering,https://www.crunchbase.com/organization/projectioneering,Biotechnology,"Frederick, Maryland, United States",Projectioneering provides project development and strategic management services.,projectioneering@netspace.net.au,+61 (0)2 8003 7449,http://www.projectioneering.com.au,,1,Seed,"$883,000",2010-03-15,Seed,"$883,000","Biotechnology, Science and Engineering",Private
BioPharma Manufacturing Solutions,https://www.crunchbase.com/organization/biopharma-manufacturing-solutions,"Biopharma, Biotechnology, Manufacturing","Seal Beach, California, United States","BioPharma Manufacturing Solutions offers technology transfer and scale-up, project management, process design, value engineering, and more.",,,,,1,Seed,"$400,700",2013-02-01,Seed,"$400,700","Biotechnology, Health Care, Manufacturing, Science and Engineering",Private
Analiza,https://www.crunchbase.com/organization/analiza,"Biotechnology, Health Diagnostics","Cleveland, Ohio, United States","Analiza is a privately held corporation dedicated to discovering, developing, and commercializing new technologies for the life sciences.",,(216) 432-9050,http://www.analiza.com/,For Profit,2,Seed,"$300,000",2008-09-04,Seed,"$600,000","Biotechnology, Health Care, Science and Engineering",Private
DIBS,https://www.crunchbase.com/organization/dibs-3,"Biotechnology, Health Care, Information Technology, Software","Houston, Texas, United States",Catalyzing discovery through visualization.,dibsbiotech@gmail.com,,http://www.dibsvis.com,For Profit,1,Seed,,2015-03-09,Seed,,"Biotechnology, Health Care, Information Technology, Science and Engineering, Software",Private
Organic Society,https://www.crunchbase.com/organization/organic-society,Biotechnology,"Prague, Hlavni mesto Praha, Czech Republic","Organic Society is an online marketplace that enables its users to sell, buy, swap, and share their things made with love.",bio@bio.cz,,http://www.bio.cz,For Profit,1,Seed,"$40,000",2011-12-06,Seed,"$40,000","Biotechnology, Science and Engineering",Private
"VITROLINK Biotechnological Researching, Development, Servicing and Trading Limited Liability Company",https://www.crunchbase.com/organization/vitrolink-biotechnological-researching-development-servicing-and-trading-limited-liability-company,"Biotechnology, Health Care, Health Diagnostics, Medical Device","Debrecen, Debrecen, Hungary",VITROLINK Llc. is a Hunagrian start-up company developing diagnostic software platform for pathology combining the human resource and AI. ,mail@vitrolink.com,+36317812952,http://www.vitrolink.com,For Profit,1,Seed,"$71,000",2017-10-31,Seed,"$71,000","Biotechnology, Health Care, Science and Engineering",Private
FreeStride Therapeutics,https://www.crunchbase.com/organization/freestride-therapeutics,"Biotechnology, Life Science, Veterinary","Ann Arbor, Michigan, United States",FreeStride’s drug restores bone health by preventing both inflammation and bone loss.,,,http://www.freestride.net,For Profit,1,Seed,"$100,000",2012-07-13,Seed,"$100,000","Biotechnology, Health Care, Science and Engineering",Private
Clensta ,https://www.crunchbase.com/organization/clensta,"Biotechnology, Health Care, Wellness","New Delhi, Delhi, India",A biotechnology start-up was incorporated to improve the National Hygiene condition whilst addressing the aspect of water conservation.,info@clensta.com,Ph: +91 11 2658 1765,http://clensta.com/,,1,Seed,,2017-12-11,Seed,,"Biotechnology, Health Care, Science and Engineering",Private
QurAlis,https://www.crunchbase.com/organization/quralis,Biotechnology,"Cambridge, Ontario, Canada",QurAlis is specifically focused on discovering and developing new therapies for amyotrophic lateral sclerosis,info@quralis.com,(+1) 617.682.6015 (+1) 617.682.6015,https://quralis.com/,,1,Seed,,2018-04-05,Seed,,"Biotechnology, Science and Engineering",Private
Parabon NanoLabs,https://www.crunchbase.com/organization/parabon-nanolabs,"Biotechnology, Genetics, Therapeutics","Reston, Virginia, United States","Parabon NanoLabs, we are developing a new class of nano-pharmaceuticals and advanced forensic tools by fully leveraging the power of DNA.",nanolabs@parabon.com,(703) 689-9689,http://www.parabon-nanolabs.com/,For Profit,1,Seed,,2010-06-23,Seed,,"Biotechnology, Health Care, Science and Engineering",Private
Fulmer Instruments,https://www.crunchbase.com/organization/fulmer-instruments,Biotechnology,"America, Alabama, United States","Fulmer Instruments is based in Mountain Brook, Alabama.",,(205)613-3322,,For Profit,1,Seed,"$450,000",2016-10-13,Seed,"$450,000","Biotechnology, Science and Engineering",Private
Pronec,https://www.crunchbase.com/organization/pronec,Biotechnology,"Alderley Park, Cheshire, United Kingdom",Pronec is a start-up cancer therapy company.,,,,,1,Seed,"£50,000",2016-01-01,Seed,"£50,000","Biotechnology, Science and Engineering",Private
Mezomax,https://www.crunchbase.com/organization/mezomax,"Biotechnology, Health Care, Medical","San Francisco, California, United States","MezoMax enables faster bone fracture healing, improved osteoporosis treatment, and stronger bones in elderly patients.",info@mezomaxinc.com,,http://mezomaxinc.com/,For Profit,1,Seed,,2017-12-11,Seed,,"Biotechnology, Health Care, Science and Engineering",Private
Providence Surgery,https://www.crunchbase.com/organization/providence-surgery,"Biotechnology, Health Care, Medical","Anchorage, Alaska, United States",Providence Surgery Centers is an Alaska-based company that owns and operates surgery centers.,,8182562157,http://phcsc-missionhills.com,,1,Seed,"$45,000",2011-09-27,Seed,"$45,000","Biotechnology, Health Care, Science and Engineering",Private
PillDrops,https://www.crunchbase.com/organization/pilldrops,"Biotechnology, Medical","Cambridge, Massachusetts, United States",Making the pill taking process safer and easier.,hello@pilldrops.com,,http://pilldrops.com,For Profit,1,Seed,,2016-02-01,Seed,,"Biotechnology, Health Care, Science and Engineering",Private
Ageria,https://www.crunchbase.com/organization/ageria,Biotechnology,"Cork, Cork, Ireland",Ageria is a company based in Ireland and is researching on materials which extends human life.,office@ageria-bio.com,,http://ageria-bio.com/,For Profit,1,Seed,,2015-04-30,Seed,,"Biotechnology, Science and Engineering",Private
Magellan Global Health,https://www.crunchbase.com/organization/magellan-global-health,"Biotechnology, Health Care, Medical","Carlsbad, California, United States","Magellan Global Health is a multinational healthcare delivery company established in 2010 whose founders, managers and directors include",info@magellangh.com,760-444-4804,http://magellanglobalhealth.com,,1,Seed,"$50,000",2010-11-22,Seed,"$50,000","Biotechnology, Health Care, Science and Engineering",Private
Engineering in Medicine & Biology ,https://www.crunchbase.com/organization/engineering-in-medicine-and-biology,"Association, Biotechnology, Communities, Life Science, Medical, Personal Health","San Francisco, California, United States",EMBS is dedicated to studying problems in biology and medicine which might be aided in solution by use of electronic engineering principles.,matov@ieee.org,,http://sites.ieee.org/sf-embs,Non-profit,1,Seed,,2018-04-01,Seed,,"Biotechnology, Community and Lifestyle, Health Care, Science and Engineering",Private
Aterica Health Inc.,https://www.crunchbase.com/organization/atterica-health-inc-,"Biotechnology, mHealth, Personal Health","Waterloo, Ontario, Canada",Consumer digital health start-up developing products enabling individuals & families to proactively manage their health on their own terms.,info@aterica.com,+1 (226) 476-1390,https://www.aterica.com,For Profit,1,Seed,,2013-12-23,Seed,,"Biotechnology, Health Care, Mobile, Science and Engineering",Private
Leap Therapeutics,https://www.crunchbase.com/organization/leap-therapeutics,"Biotechnology, Life Science","Cambridge, Massachusetts, United States",Leap Therapeutics is a clinical-stage biopharmaceutical company.,info@leaptx.com,(617)714-0360,http://www.leaptx.com/,For Profit,1,Seed,,2015-02-28,Seed,,"Biotechnology, Science and Engineering",Private
Aranex Biotech,https://www.crunchbase.com/organization/aranex-biotech,Biotechnology,"Toronto, Ontario, Canada",Aranex is developing peanuts without major allergens.,info@aranexbio.com,1(416) 970-0167,http://www.aranexbio.com/,For Profit,1,Seed,,2015-04-30,Seed,,"Biotechnology, Science and Engineering",Private
AxialMED,https://www.crunchbase.com/organization/axialmed,"Biotechnology, Hospital, Supply Chain Management","El Cajon, California, United States",AxialMED is a biotechnology company engaged in the development of orthopedic products.,,619 795 4627,http://axialmedical.com,,1,Seed,"$17,408",2011-08-10,Seed,"$17,408","Biotechnology, Health Care, Science and Engineering, Transportation",Private
Amaryllis Nucleics,https://www.crunchbase.com/organization/amaryllis-nucleics,Biotechnology,"San Francisco, California, United States",Their products break down time & cost barriers in RNA sequencing empowering researchers and accelerating important discoveries in genomics.,info@AmaryllisNucleics.com,(415)508-3230,http://AmaryllisNucleics.com,For Profit,1,Seed,,2016-02-17,Seed,,"Biotechnology, Science and Engineering",Private
Milis Bio,https://www.crunchbase.com/organization/milis-bio,Biotechnology,"Cork, Ireland, Europe",MilisBio is developing a sugar substitute from protein that will satiate Their cravings without harming our health.,info@milisbio.com,+353863327156,http://www.milisbio.com/,For Profit,2,Seed,,2016-10-01,Seed,,"Biotechnology, Science and Engineering",Private
Nanoly,https://www.crunchbase.com/organization/nanoly,Biotechnology,"Boulder, Colorado, United States",Nanoly is engaged in the development of a polymer that enables vaccines and therapeutics to survive without refrigeration.,info@nanolybioscience.com,,http://www.nanoly.info/,For Profit,2,Seed,,2016-05-10,Seed,,"Biotechnology, Science and Engineering",Private
Vetherapy,https://www.crunchbase.com/organization/vetherapy,"Biotechnology, Medical, Veterinary","Coimbrã, Leiria, Portugal","Vetherapy develops products with great therapeutical potencial, based on stem cells, platelet-rich plasma (PRP) and biomaterials.",hello@vetherapy.pt,,http://vetherapy.pt/,For Profit,1,Seed,,2018-01-22,Seed,,"Biotechnology, Health Care, Science and Engineering",Private
Srnalytics,https://www.crunchbase.com/organization/srnalytics,"Biotechnology, Health Care, Medical","San Francisco, California, United States",sRNAlytics is developing the next generation of biomarkers,david.salzman@srnalytics.com,,http://www.srnalytics.com,For Profit,1,Seed,,2017-11-14,Seed,,"Biotechnology, Health Care, Science and Engineering",Private
Predictus BioSciences,https://www.crunchbase.com/organization/predictus-biosciences,"Biotechnology, Health Care, Health Diagnostics","West Roxbury, Massachusetts, United States",Predictus BioSciences is a diagnostic substance biotechnology startup.,,,,,1,Seed,"$500,000",2011-01-12,Seed,"$500,000","Biotechnology, Health Care, Science and Engineering",Private
Hydrocapsule,https://www.crunchbase.com/organization/hydrocapsule,"Biotechnology, Life Science, Medical","Jasper, Georgia, United States",Hydrocapsule is a life sciences company specializing in experimental polymer capsule development and aqueous payloads.,info@hydrocapsule.com, 706-692-0193,http://hydrocapsule.com,,1,Seed,"$25,000",2010-08-24,Seed,"$25,000","Biotechnology, Health Care, Science and Engineering",Private
Octagon Therapeutics,https://www.crunchbase.com/organization/octagon-therapeutics,Biotechnology,,A Biotech Company  based in the Pagliuca Life Lab directly adjacent to Harvard campus.,info@octagontherapeutics.com,(781) 910-8518,https://www.octagontherapeutics.com/,,1,Seed,,2018-02-13,Seed,,"Biotechnology, Science and Engineering",Private
Numaferm,https://www.crunchbase.com/organization/numaferm,Biotechnology,"Düsseldorf, Nordrhein-Westfalen, Germany",A Dusseldorf University spin-off that specializes in the biotechnical production,info@numaferm.com,+4921197532901,http://numaferm.com/,For Profit,1,Seed,,2017-05-13,Seed,,"Biotechnology, Science and Engineering",Private
New Port Richey Surgery Center,https://www.crunchbase.com/organization/new-port-richey-surgery-center,"Biotechnology, Health Care, Hospital","New Port Richey, Florida, United States",New Port Richey Surgery Center provides surgical care and outpatient surgery services in various procedures.,,727-848-0446,http://nprsurgerycenter.com,,1,Seed,"$178,486",2011-09-01,Seed,"$178,486","Biotechnology, Health Care, Science and Engineering",Private
Nanotech Biomachines,https://www.crunchbase.com/organization/nanotech-biomachines,Biotechnology,"Richmond, California, United States",Nanotech Biomachines develops a sensor technology for therapeutic discovery and development applications.,info@nanotechbio.com,+118559006266,http://www.nanotechbio.com/,For Profit,3,Seed,,2017-03-27,Seed,,"Biotechnology, Science and Engineering",Private
Pure Cultures,https://www.crunchbase.com/organization/pure-cultures,Biotechnology,"Denver, Colorado, United States","Pure Cultures is an artisan facility providing custom, state-of-the-art probiotic strains for clients nationwide.",info@purecultures.com,(720)343-6943,http://purecultures.com/,For Profit,1,Seed,,2016-09-20,Seed,,"Biotechnology, Science and Engineering",Private
PROTEIN LOUNGE,https://www.crunchbase.com/organization/protein-lounge,"Bioinformatics, Biotechnology, Database","San Diego, California, United States",Protein Lounge is a gene-centric web portal that offers databases of model organisms and molecular and bioinformatics research tools.,info@proteinlounge.com,858-705-5968 ,http://www.proteinlounge.com,,1,Seed,"$1,000",2011-06-14,Seed,"$1,000","Biotechnology, Data and Analytics, Science and Engineering, Software",Private
AstRoNA Biotechnologies,https://www.crunchbase.com/organization/astrona-biotechnologies,"Biotechnology, Health Care, Pharmaceutical","San Francisco, California, United States",It is engineering a simple to use detector that can be deployed on-site at every phase of food production from field to table.,,,http://www.astronabio.com/,For Profit,1,Seed,,2016-02-19,Seed,,"Biotechnology, Health Care, Science and Engineering",Private
Stelvio Oncology,https://www.crunchbase.com/organization/stelvio-oncology,"Biotechnology, Medical, Pharmaceutical","San Francisco, California, United States",Stelvio Oncology is focused on delivering precision medicine diagnostics and novel therapeutics for glioblastoma.,,(604) 655-4756,https://www.stelvio-oncology.com/,For Profit,1,Seed,,2017-05-05,Seed,,"Biotechnology, Health Care, Science and Engineering",Private
UBA Biologix,https://www.crunchbase.com/organization/uba-biologix,"Biotechnology, Mining, Water Purification","San Francisco, California, United States","UBA Biologix cleans industrial wastewater from coal, gold, and platinum mines with an organic bioremediation system.",info@ubabiologix.co,1(234)567-890,https://www.ubabiologix.co,For Profit,1,Seed,,2017-05-31,Seed,,"Biotechnology, Natural Resources, Science and Engineering, Sustainability",Private
