Genable Technologies Ltd.,https://www.crunchbase.com/organization/genable-technologies-ltd,"Biotechnology, Genetics, Health Care","Dublin, Dublin, Ireland","Genable Technologies Ltd. is a privately held, venture backed, Dublin (Ireland) based bio-pharmaceutical company developing new gene",jloveridge@genable.net,+33 674177812,http://www.genable.net,,1,M&A,"€5,000,000",11/10/09,Series B,"€5,000,000","Biotechnology, Health Care, Science and Engineering",Private
Antiva Biosciences,https://www.crunchbase.com/organization/hera-therapeutics,"Biotechnology, Health Care, Medical","Del Mar, California, United States","A biopharmaceutical company developing novel, localized therapeutics for the treatment of diseases caused by HPV infection.",info@antivabio.com,(650)822-1400,http://www.antivabio.com,For Profit,5,Late Stage Venture,"$22,000,000 ",3/28/17,Series C,"$41,346,025 ","Biotechnology, Health Care, Science and Engineering",Private
Inbiomotion,https://www.crunchbase.com/organization/inbiomotion,"Biotechnology, Genetics, Health Diagnostics","Barcelona, Catalonia, Spain",Inbiomotion is a personalized medicine company developing biomarkers that can predict bone metastasis in cancers.,cducco@inbiomotion.com,34932556115,http://inbiomotion.com,For Profit,3,Early Stage Venture,"€2,200,000",3/13/16,Series B,"€4,250,000","Biotechnology, Health Care, Science and Engineering",Private
Xigen,https://www.crunchbase.com/organization/xigen,"Biopharma, Biotechnology, Therapeutics","Epalinges, Vaud, Switzerland","Xigen, a biopharmaceutical company, develops therapeutics to inhibit intracellular protein interactions.",info@xigenpharma.com,41213211081,http://www.xigenpharma.com,,2,Early Stage Venture,"$20,000,000 ",11/20/09,Series B,"$41,000,000 ","Biotechnology, Health Care, Science and Engineering",Private
Firalis,https://www.crunchbase.com/organization/firalis,Biotechnology,"Huningue, Alsace, France",Firalis is a biotechnology company.,contact@firalis.com,3.3039E+11,http://firalis.com,For Profit,2,Early Stage Venture,"€1,482,000",7/4/13,Series B,"€1,932,000","Biotechnology, Science and Engineering",Private
MetaCure,https://www.crunchbase.com/organization/metacure,"Biotechnology, Diabetes, Electronics","Kfar Saba, HaMerkaz, Israel",MetaCure develops implantable devices for the treatment of Type II (adult) diabetes.,contact@metacure.com,97297680376,http://www.metacure.com,For Profit,1,Early Stage Venture,"$20,000,000 ",5/10/09,Series B,"$20,000,000 ","Biotechnology, Consumer Electronics, Hardware, Health Care, Science and Engineering",Private
Cytochroma,https://www.crunchbase.com/organization/cytochroma,"Biotechnology, Clinical Trials, Pharmaceutical","Kingston, Ontario, Canada","Cytochroma is a clinical stage specialty pharmaceutical company that designs, develops and commercializes prescription products to treat",,847-236-7707,http://www.cytochroma.com,,6,M&A,"CA$45,000,000",7/30/08,Series C,"$75,830,926 ","Biotechnology, Health Care, Science and Engineering",Private
S CAP,https://www.crunchbase.com/organization/s-cap-consultancy,"Biotechnology, Oil and Gas","New York, New York, United States","S CAP is an impact investor focusing on CSR to bring about a social change in the Environmental, Food & Biotech industries.",bizplan@scapadvisors.com,,http://www.scapadvisors.com/,For Profit,1,Early Stage Venture,"$350,000 ",12/30/14,Series B,"$350,000 ","Biotechnology, Energy, Natural Resources, Science and Engineering",Private
Mpex Pharmaceuticals,https://www.crunchbase.com/organization/mpex-pharmaceuticals,"Biotechnology, Health Care, Therapeutics","San Diego, California, United States",Mpex Pharmaceuticals is focused on developing new therapies to fight the growing issue of antibiotic resistance.,info@mpexpharma.com,18588752851,http://www.mpexpharma.com,,2,Late Stage Venture,"$27,500,000 ",2/10/09,Series D,"$59,500,000 ","Biotechnology, Health Care, Science and Engineering",Private
Senhwa Biosciences,https://www.crunchbase.com/organization/senhwa-biosciences,"Biotechnology, Developer Platform, Health Care","San Diego, California, United States",Senhwa is a drug development company creating innovative therapies for cancer and related diseases.,,8585526808,http://senhwabiosciences.com,,1,Early Stage Venture,"$17,000,000 ",12/12/13,Series B,"$17,000,000 ","Biotechnology, Health Care, Science and Engineering, Software",Private
Imalux Corporation,https://www.crunchbase.com/organization/imalux-corporation,"Biotechnology, Hardware, Medical Device","Cleveland, Ohio, United States","Imalux Corporation is a novel imaging technology, Optical Coherence Tomography (OCT).",info@imalux.com,(216)502-0755,http://imalux.com,For Profit,5,Late Stage Venture,"$600,000 ",6/1/12,Series D,"$14,280,000 ","Biotechnology, Hardware, Health Care, Science and Engineering",Private
Mirador Biomedical,https://www.crunchbase.com/organization/mirador-biomedical,Biotechnology,"Seattle, Washington, United States",Mirador Biomedical develops innovative medical devices to alleviate doubt and uncertainty during common medical procedures.,info@miradorbiomedical.com,(206)755-5470,http://miradorbiomedical.com,For Profit,2,M&A,"$1,500,000 ",7/8/11,Series B,"$2,600,000 ","Biotechnology, Science and Engineering",Private
Resolve Therapeutics,https://www.crunchbase.com/organization/resolve-therapeutics,"Biotechnology, Pharmaceutical, Therapeutics","Kirkland, Washington, United States",Resolve Therapeutics is focused on developing a novel approach to the treatment of Systemic Lupus Erythematosus (SLE).,,425-576-4100,http://www.resolvebio.com,,3,Early Stage Venture,"$5,800,000 ",11/1/12,Series B,"$8,883,334 ","Biotechnology, Health Care, Science and Engineering",Private
Kreatech Diagnostics,https://www.crunchbase.com/organization/kreatech-diagnostics,"Biotechnology, Health Diagnostics","Amsterdam, Noord-Holland, The Netherlands",Kreatech Diagnostics develops detection products for diagnostic and research applications in the life sciences and healthcare industries.,info@kreatech.com,31 20 311 3725,http://www.kreatech.com/Default.aspx,,2,M&A,"$2,700,000 ",1/31/10,Series B,"$5,700,000 ","Biotechnology, Health Care, Science and Engineering",Private
Eucure Biopharma,https://www.crunchbase.com/organization/eucure-biopharma,Biotechnology,"Beijing, Beijing, China",Biotechnology company based in Beijing.,,,,,1,Early Stage Venture,"$19,000,000 ",3/28/18,Series B,"$19,000,000 ","Biotechnology, Science and Engineering",Private
Momentum Bioscience,https://www.crunchbase.com/organization/momentum-bioscience,Biotechnology,"Reading, Reading, United Kingdom",Momentum Bioscience develops enzyme mediated amplification solutions for the rapid detection of pathogens in blood and sterile fluids.,info@momentumbio.co.uk,44 1189 357 344,http://www.momentumbio.co.uk,,4,Early Stage Venture,,7/17/15,Series B,"£2,397,000","Biotechnology, Science and Engineering",Private
Terapio,https://www.crunchbase.com/organization/terapio,Biotechnology,"Austin, Texas, United States",Terapio is a biopharmaceutical company developing therapeutics based on the RLIP76 protein.,terapio.admin@terapio.com,5122874241,http://www.terapio.com,,3,Early Stage Venture,"$780,000 ",7/21/15,Series B,"$7,480,000 ","Biotechnology, Science and Engineering",Private
Gloucester Pharmaceuticals,https://www.crunchbase.com/organization/gloucester-pharmaceuticals,"Biotechnology, Health Care, Medical","Cambridge, Massachusetts, United States",Gloucester Pharmaceuticals acquires clinical-stage oncology drug candidates and advances them through approvals and commercialization.,contact@gloucesterpharma.com,617-583-1300,http://www.gloucesterpharma.com,For Profit,15,M&A,"$29,000,000 ",8/25/09,Series D,"$124,562,247 ","Biotechnology, Health Care, Science and Engineering",Private
hdl therapeutics,https://www.crunchbase.com/organization/hdl-therapeutics,"Biotechnology, Medical Device, Therapeutics","Short Hills, New Jersey, United States",HDL Therapeutics is a cardiovascular device company specializing in the field of reversing coronary atherosclerosis.,info@hdltherapeutics.com,(772) 453-2770,http://hdltherapeutics.com,,3,Late Stage Venture,"$1,486,610 ",9/14/16,Series C,"$4,456,610 ","Biotechnology, Health Care, Science and Engineering",Private
"Gencia, LLC",https://www.crunchbase.com/organization/gencia,"Biotechnology, Health Care, Pharmaceutical","Charlottesville, Virginia, United States","Gencia, LLC operates as a biotechnology company. The company was founded in 2002 and is based in Charlottesville, Virginia.",career@genciabiotech.com,434 295 4800,https://www.genciabiotech.com,For Profit,4,Early Stage Venture,"$680,000 ",7/16/13,Series B,"$5,730,000 ","Biotechnology, Health Care, Science and Engineering",Private
Promosome,https://www.crunchbase.com/organization/promosome,"Biotechnology, Health Care, Pharmaceutical","New York, New York, United States",Promosome is specialized in technologies related to the regulation of protein synthesis through translation initiation.,info@promosome.com,508-845-2255,http://www.promosome.com,,2,Late Stage Venture,"$4,100,000 ",1/25/11,Series C,"$13,700,000 ","Biotechnology, Health Care, Science and Engineering",Private
Anaconda Pharma,https://www.crunchbase.com/organization/anaconda-pharma,Biotechnology,"Paris, Ile-de-France, France",Anaconda Pharma is a biopharmaceutical company focusing on the development of treatments for infections by human papillomavirus (HPV).,contact@anacondapharma.com,33182287301,http://www.anacondapharma.com,For Profit,1,M&A,"$3,240,000 ",7/19/10,Series B,"$3,240,000 ","Biotechnology, Science and Engineering",Private
Stromedix,https://www.crunchbase.com/organization/stromedix,"Biotechnology, Health Care, Medical Device","Cambridge, Massachusetts, United States","Storemedix is a biomedical company focused on drugs for fibrosis, organ failure and cancer.",info@stromedix.com,617.674.8400,http://www.stromedix.com,For Profit,3,M&A,"$2,000,000 ",1/26/11,Series C,"$28,000,000 ","Biotechnology, Health Care, Science and Engineering",Private
Mind-NRG,https://www.crunchbase.com/organization/mind-nrg,"Biotechnology, Medical Device, Neuroscience","Geneva, Geneve, Switzerland",Mind-NRG develops peptidic neurotrophic factors for psychiatric and neurologic diseases.,info@mind-nrg.com,41 22 737 00 00,http://www.mind-nrg.com/,For Profit,3,Early Stage Venture,"€6,000,000",9/4/13,Series B,"$23,698,412 ","Biotechnology, Health Care, Science and Engineering",Private
HistoSonics,https://www.crunchbase.com/organization/histosonics,"Biotechnology, Health Care, Therapeutics","Ann Arbor, Michigan, United States","HistoSonics develops Histotripsy, a tool that uses focused sound waves to non-invasively break up tumors and lesions.",info@histosonics.com,734-926-4630,http://www.histosonics.com,,5,Early Stage Venture,"$8,260,313 ",3/13/17,Series B,"$38,432,731 ","Biotechnology, Health Care, Science and Engineering",Private
to-BBB,https://www.crunchbase.com/organization/to-bbb,"Biopharma, Biotechnology, Pharmaceutical","Leiden, Zuid-Holland, The Netherlands",The Company combines existing drugs with to-BBB’s proprietary G-Technology® for enhanced drug delivery across the blood-brain barrier.,,31 71 332 2255,http://www.tobbb.com/home,,5,Late Stage Venture,"€10,000,000",7/2/14,Series C,"€21,700,000","Biotechnology, Health Care, Science and Engineering",Private
CrystalGenomics,https://www.crunchbase.com/organization/crystalgenomics,"Biotechnology, Health Care, Pharmaceutical","Seongnam, Kyonggi-do, South Korea","CrystalGenomics is a structural chemoproteomics-based drug discovery and development company in Seoul, Korea.",info@cgxinc.com,82 3 1628 2700,http://www.cgxinc.com,For Profit,2,Early Stage Venture,"$12,800,000 ",6/25/14,Series B,"$15,400,000 ","Biotechnology, Health Care, Science and Engineering",Private
HealOr,https://www.crunchbase.com/organization/healor,"Biotechnology, Pharmaceutical, Therapeutics","Rehovot, HaMerkaz, Israel","HealOr, a biopharmaceutical company, develops topical therapeutics for dermal skin pathologies.",kira@healor.com,97289407515,http://www.healor.com,For Profit,2,Late Stage Venture,"$7,500,000 ",11/4/10,Series C,"$15,500,000 ","Biotechnology, Health Care, Science and Engineering",Private
Athenix,https://www.crunchbase.com/organization/athenix,"Agriculture, Biotechnology, Chemical","Raleigh, North Carolina, United States","Athenix is a crop science company focused on the areas of seeds, crop protection and non-agricultural pest control.",info@athenixcorp.com,919-328-4100 ,http://www.athenixcorp.com,,4,M&A,"$10,000,000 ",7/23/08,Series D,"$43,500,000 ","Agriculture and Farming, Biotechnology, Science and Engineering",Private
Tigris Pharmaceuticals,https://www.crunchbase.com/organization/tigris-pharmaceuticals,"Biotechnology, Health Care, Pharmaceutical","Bonita Springs, Florida, United States",Tigris Pharmaceuticals is a biopharmaceutical company developing therapeutic technologies for cancer and other unmet medical needs.,info@tigrispharma.com,239.444.5400,http://www.tigrispharma.com,,3,Late Stage Venture,"$6,500,000 ",9/28/10,Series C,"$32,490,000 ","Biotechnology, Health Care, Science and Engineering",Private
Primaeva Medical,https://www.crunchbase.com/organization/primaeva-medical,"Biotechnology, Health Care, Therapeutics","Pleasanton, California, United States","Primaeva Medical is a venture capital funded company developing devices for dermatologists, plastic surgeons and other cosmetic physicians.",info@primaeva.com,925.621.6100,http://www.primaevamedical.com,For Profit,3,M&A,"$6,000,000 ",2/21/09,Series C,"$14,250,000 ","Biotechnology, Health Care, Science and Engineering",Private
VM Discovery,https://www.crunchbase.com/organization/vm-discovery,"Biotechnology, Medical, Product Design","Fremont, California, United States","VM Discovery, a drug discovery firm, offers drug design and optimization services to identify multiproperty-optimized drug candidates.",,8666060927,http://vmdiscovery.com/,,4,Late Stage Venture,"$12,600,000 ",7/23/14,Series C,"$15,120,000 ","Biotechnology, Design, Health Care, Science and Engineering",Private
Cytheris,https://www.crunchbase.com/organization/cytheris,"Biopharma, Biotechnology, Therapeutics","Issy-les-moulineaux, Ile-de-France, France",Cytheris is biopharmaceutical company focused on the R&D of therapies for immune modulation.,info@cytheris.com,33-(0)-1-5888-3800,http://www.cytheris.com,,2,Late Stage Venture,"$15,000,000 ",6/7/10,Series D,"$45,700,000 ","Biotechnology, Health Care, Science and Engineering",Private
TaiMed Biologics,https://www.crunchbase.com/organization/taimed-biologics,"Biotechnology, Medical, Test and Measurement","Taipei, T'ai-pei, Taiwan","TaiMed Biologics offers Ibalizumab, a monoclonal antibody and a member of HIV viral-entry inhibitor therapy.",,8.86227E+11,http://www.taimedbiologics.com.tw,For Profit,1,Early Stage Venture,"$22,000,000 ",3/31/10,Series B,"$22,000,000 ","Biotechnology, Data and Analytics, Health Care, Science and Engineering",Private
Lumora,https://www.crunchbase.com/organization/lumora,"Biotechnology, Health Diagnostics","Ely, Cambridgeshire, United Kingdom","Lumora develops work flow-based solutions that simplify clinical diagnostics, industrial microbiology, and sample preparation.",info@lumora.co.uk,44 1353 646 285,http://www.lumora.co.uk,,2,M&A,"£1,500,000",5/26/11,Series B,"£1,500,000","Biotechnology, Health Care, Science and Engineering",Private
Lophius Biosciences,https://www.crunchbase.com/organization/lophius-biosciences,"Biotechnology, Health Care, Health Diagnostics","Regensburg, Bayern, Germany",Lophius Biosciences is a biotechnology company developing products for the diagnosis of acute infectious and autoimmune diseases.,info@lophius.de,49 491 94 44 637,http://www.lophius.com/,,8,Late Stage Venture,"€2,200,000",3/18/17,Series H,"$14,407,891 ","Biotechnology, Health Care, Science and Engineering",Private
Helicon Therapeutics,https://www.crunchbase.com/organization/helicon-therapeutics,"Biotechnology, Genetics, Neuroscience, Therapeutics","San Diego, California, United States",Helicon Therapeutics discovers therapeutics to treat disorders of cognition through genetic basis of long-term memory formation.,info@helicontherapeutics.com,858-246-8120,http://www.helicontherapeutics.com,For Profit,5,Late Stage Venture,"$50,000,000 ",9/29/09,Series F,"$108,798,000 ","Biotechnology, Health Care, Science and Engineering",Private
Altair Therapeutics,https://www.crunchbase.com/organization/altair-therapeutics,"Biopharma, Biotechnology, Therapeutics","San Diego, California, United States",Altair Therapeutics was a biopharmaceutical company that focused on developing therapeutics to treat human respiratory diseases.,info@altairthera.com,858-436-3838,http://www.altairthera.com,,2,Early Stage Venture,"$17,000,000 ",2/2/10,Series B,"$23,466,666 ","Biotechnology, Health Care, Science and Engineering",Private
ERA Biotech,https://www.crunchbase.com/organization/era-biotech,"Biopharma, Biotechnology, Manufacturing","Barcelona, Catalonia, Spain","ERA Biotech develops, implements and licenses cell-based biomanufacturing technologies.",info@erabiotech.com,34 934 03 47 73,http://www.erabiotech.com,,3,M&A,"$5,300,000 ",9/16/09,Series B,"$13,323,300 ","Biotechnology, Health Care, Manufacturing, Science and Engineering",Private
Genesystem,https://www.crunchbase.com/organization/genesystem,Biotechnology,"Daejeon, Taejon-jikhalsi, South Korea",Genesystem is biotech engineering company.,,82428638551,http://www.genesystem.co.kr/,For Profit,1,Early Stage Venture,"₩1,000,000,000",3/1/17,Series B,"₩1,000,000,000","Biotechnology, Science and Engineering",Private
Novita Therapeutics,https://www.crunchbase.com/organization/novita-therapeutics,"Biotechnology, Health Care, Pharmaceutical","Olathe, Kansas, United States","Novita Therapeutics is a privately held biopharmaceutical and medical device company headquartered in Lenexa, Kansas.",info@novitatherapeutics.com,(913)440-4439,http://www.novitatherapeutics.com,For Profit,6,Early Stage Venture,"$3,155,000 ",10/21/13,Series B,"$7,745,000 ","Biotechnology, Health Care, Science and Engineering",Private
Sagetis Biotech,https://www.crunchbase.com/organization/sagetis-biotech,Biotechnology,"Barcelona, Catalonia, Spain",Sagetis Biotech develops release systems that allow more effective administration of drugs to treat diseases of the central nervous system.,info@sagetis-biotech.com,34 93 309 71 69,http://www.sagetis-biotech.com,,2,Early Stage Venture,"$2,000,000 ",7/22/11,Series B,"$2,000,000 ","Biotechnology, Science and Engineering",Private
Oncos Therapeutics,https://www.crunchbase.com/organization/oncos-therapeutics,Biotechnology,"Helsinki, Southern Finland, Finland",Oncos Therapeutics is a biotech company developing cancer therapies based on its next generation oncolytic viruses.,info@oncostherapeutics.com,358 4005 69628,http://www.oncos.com,,1,M&A,"$5,500,000 ",4/30/10,Series C,"$5,500,000 ","Biotechnology, Science and Engineering",Private
Rhenovia Pharma,https://www.crunchbase.com/organization/rhenovia-pharma,"Biotechnology, Health Diagnostics, Therapeutics","Mulhouse, Alsace, France",Rhenovia Pharma SAS is a French biotechnology company founded in 2007 by an international team that brings together managers from large,info@rhenovia.com,33 3 89 32 76 84,http://rhenovia.com,,2,Early Stage Venture,"€540,000",2/12/14,Series B,"€930,000","Biotechnology, Health Care, Science and Engineering",Private
Moerae Matrix,https://www.crunchbase.com/organization/moerae-matrix,"Biopharma, Biotechnology, Therapeutics","Morristown, New Jersey, United States",Moerae Matrix is a biopharmaceutical company developing targeted therapeutics for fibrotic diseases.,info@moeraematrix.com,9735315093,http://moeraematrix.com,,1,Early Stage Venture,"$5,534,612 ",1/10/13,Series B,"$5,534,612 ","Biotechnology, Health Care, Science and Engineering",Private
Graftys,https://www.crunchbase.com/organization/graftys,Biotechnology,"Aix-en-provence, Provence-Alpes-Cote d'Azur, France",Graftys is a France-based early-stage company focused on advanced bone biologics.,contact@graftys.fr,+33(4) 42 60 30 00,http://www.graftys.com/en,,1,Late Stage Venture,"€5,300,000",4/26/11,Series C,"€5,300,000","Biotechnology, Science and Engineering",Private
Cascade Prodrug,https://www.crunchbase.com/organization/cascade-prodrug,"Biotechnology, Pharmaceutical, Therapeutics","Portland, Oregon, United States","Cascade Prodrug, a revitalized pharmaceutical company, develops targeted prodrug therapies for hyper-proliferative diseases.",,(541)343-6025,http://cascadeprodrug.com,For Profit,3,Early Stage Venture,,10/1/16,Series B,"$1,448,932 ","Biotechnology, Health Care, Science and Engineering",Private
Intradigm Corporation,https://www.crunchbase.com/organization/intradigm-corporation,"Biotechnology, Health Care, Therapeutics","Palo Alto, California, United States",Intradigm Corporation is a biotechnology company developing systematic RNA interference therapeutics.,,(650) 855 9696,http://www.intradigm.com,For Profit,2,M&A,"$21,400,000 ",1/7/09,Series B,"$37,400,000 ","Biotechnology, Health Care, Science and Engineering",Private
Molecular Biometrics,https://www.crunchbase.com/organization/molecular-biometrics,"Biotechnology, Health Care, Medical Device","Norwood, Massachusetts, United States",Molecular Biometrics applies metabolomic technologies to develop non-invasive methodologies for evaluating biologic function in health.,info@molecularbiometrics.com,781-501-5600,http://www.molecularbiometrics.com,For Profit,2,Early Stage Venture,"$12,500,000 ",1/12/10,Series B,"$24,500,000 ","Biotechnology, Health Care, Science and Engineering",Private
Gyros,https://www.crunchbase.com/organization/gyros,"Biotechnology, Health Care, Therapeutics","Monmouth Junction, New Jersey, United States",Gyros is specialized in the production of automated micro-immunoassays for therapeutic protein development.,information@gyros.com,(461)856-6300,http://www.gyros.com,For Profit,1,Late Stage Venture,"$10,400,000 ",7/6/09,Series C,"$10,400,000 ","Biotechnology, Health Care, Science and Engineering",Private
BioCeramic Therapeutics,https://www.crunchbase.com/organization/bioceramic-therapeutics,"Biotechnology, Health Diagnostics, Medical","London, England, United Kingdom",BioCeramic Therapeutics develops medical interventions that enable the body to renew damaged tissues.,,+44 (0) 20 7594 1326,http://www.bioceramictherapeutics.com,,2,Early Stage Venture,"$1,900,000 ",1/17/10,Series B,"$3,947,042 ","Biotechnology, Health Care, Science and Engineering",Private
Subitec,https://www.crunchbase.com/organization/subitec,"Biotechnology, Cosmetics, Food Processing","Stuttgart, Baden-Wurttemberg, Germany",Subitec is engaged in the production of microalgae biomass substances for the cosmetics and food additives industries.,info@subitec.com,49 711 970 4200,http://subitec.com,For Profit,2,Early Stage Venture,"€4,500,000",7/16/12,Series B,"€5,110,000","Biotechnology, Consumer Goods, Food and Beverage, Science and Engineering",Private
Cequent Pharmaceuticals,https://www.crunchbase.com/organization/cequent-pharmaceuticals,"Biotechnology, Health Care, Therapeutics","Cambridge, Massachusetts, United States",Cequent is a biopharmaceutical company pioneering the development of novel therapeutics to prevent and treat a wide range of human diseases.,info@cequentpharma.com,617-995-7940,http://www.cequentpharma.com,,2,Early Stage Venture,"$3,400,000 ",10/1/09,Series B,"$12,400,000 ","Biotechnology, Health Care, Science and Engineering",Private
Innovative Spinal Technologies,https://www.crunchbase.com/organization/innovative-spinal-technologies,"Biotechnology, Health Care, Medical Device","Plano, Texas, United States","Innovative Spinal Technologies, a biotech company, develops motion preservation and minimally-invasive treatments for spinal disorders.",,972-403-5544,http://www.istspine.com,For Profit,4,M&A,"$18,000,000 ",9/8/08,Series C,"$63,200,000 ","Biotechnology, Health Care, Science and Engineering",Private
AzarGen Biotechnologies,https://www.crunchbase.com/organization/azargen-biotechnologies,"Biotechnology, Genetics","Stellenbosch, NA - South Africa, South Africa",AzarGen is a biotechnology company focused on developing human therapeutic proteins using advanced genetic engineering & synthetic biology.,cobus@azargen.com,27835895707,http://www.azargen.com/,For Profit,1,Early Stage Venture,"$3,100,000 ",1/7/16,Series B,"$3,100,000 ","Biotechnology, Health Care, Science and Engineering",Private
"EuBiologics Co., Ltd.",https://www.crunchbase.com/organization/eubiologics-co-ltd,"Biopharma, Biotechnology, Medical","Seoul, Seoul-t'ukpyolsi, South Korea",Privately‐held Korean biopharmaceutical company providing CRMO services and developing a portfolio of vaccines for global public health.,,82 3 3817 4001,http://www.eubiologics.com/en/main/,,1,Early Stage Venture,"$7,500,000 ",4/1/14,Series B,"$7,500,000 ","Biotechnology, Health Care, Science and Engineering",Private
Action Pharma,https://www.crunchbase.com/organization/action-pharma,"Biotechnology, Health Care, Pharmaceutical","Aarhus, Midtjylland, Denmark","Action Pharma develops pharmaceutical products and treatment concepts for cardiovascular, inflammatory and acquired metabolic diseases.",ils@actionpharma.com,+(45) 2020 3687 ,http://www.actionpharma.com,,3,Late Stage Venture,"$6,300,000 ",7/16/10,Series C,"$34,321,613 ","Biotechnology, Health Care, Science and Engineering",Private
