Solynta,https://www.crunchbase.com/organization/solynta,"Agriculture, AgTech, Biotechnology","Wageningen, Gelderland, The Netherlands","Solynta is a breeding and biotechnology company based in Wageningen, the Netherlands.",hein.kruyt@solynta.com,31 612 15 10 55,http://www.solynta.com,For Profit,2,Early Stage Venture,"€16,000,000",11/23/17,Series B,"€18,500,000","Agriculture and Farming, Biotechnology, Science and Engineering",Private
Daylight Solutions,https://www.crunchbase.com/organization/daylight-solutions,"Biotechnology, Health Diagnostics, Medical","San Diego, California, United States","Daylight Solutions manufactures molecular detection and imaging instruments for diagnostics, homeland security, military and more.",info@daylightsolutions.com,8586799470,http://www.daylightsolutions.com,,5,M&A,"$15,000,000 ",7/11/11,Series C,"$36,000,000 ","Biotechnology, Health Care, Science and Engineering",Private
ApiFix,https://www.crunchbase.com/organization/apifix,"Biotechnology, Health Care, Medical","Misgav Dov, HaMerkaz, Israel",ApiFix minimally invasive scoliosis correction system is aimed to treat patients suffering from Adolescent Idiopathic Scoliosis (AIS) that,info@apifix.com,972-54-550-1406,http://apifix.com,,2,Early Stage Venture,"$5,000,000 ",11/29/16,Series B,"$5,000,000 ","Biotechnology, Health Care, Science and Engineering",Private
AiCuris,https://www.crunchbase.com/organization/aicuris,"Biotechnology, Health Care, Therapeutics","Wuppertal, Nordrhein-Westfalen, Germany","AiCuris is a pharmaceutical company that discovers, researches and develops antiviral and antibacterial agents to treat infectious diseases.",info@aicuris.com,0049 202 31763 0,http://www.aicuris.com,For Profit,1,Early Stage Venture,"$74,800,000 ",4/23/10,Series B,"$74,800,000 ","Biotechnology, Health Care, Science and Engineering",Private
XW Laboratories,https://www.crunchbase.com/organization/xw-laboratories,"Biotechnology, Health Care, Pharmaceutical","Wuhan, Hubei, China",XW Laboratories Inc. develops a portfolio of internally discovered product candidates for the potential treatment of neurological disorders.,hr@xwlabs.com,8.62788E+11,http://en.xwlabs.com/,For Profit,1,Early Stage Venture,"$17,500,000 ",9/20/17,Series B,"$17,500,000 ","Biotechnology, Health Care, Science and Engineering",Private
Stemedica Cell Technologies,https://www.crunchbase.com/organization/stemedica-cell-technologies,"Biotechnology, Hospital, Medical","San Diego, California, United States",Stemedica Cell Technologies develops adult stem cells and stem cell factors for research institutions and hospitals for clinical studies.,Info@Stemedica.com,858-658-0910,http://www.stemedica.com,,2,Early Stage Venture,"$22,000,000 ",12/31/09,Series B,"$67,000,000 ","Biotechnology, Health Care, Science and Engineering",Private
AM Pharma,https://www.crunchbase.com/organization/am-pharma,"Biotechnology, Medical, Pharmaceutical","Bunnik, Utrecht, The Netherlands",AM-Pharma is a biopharmaceutical company focused on the development of therapeutics to treat inflammatory and infectious diseases.,,+ 31 (0)30 228 92 22,http://www.am-pharma.com,For Profit,6,Late Stage Venture,"€12,200,000",9/11/14,Series E,"€44,540,000","Biotechnology, Health Care, Science and Engineering",Private
HemaQuest Pharmaceuticals,https://www.crunchbase.com/organization/hemaquest,"Biotechnology, Pharmaceutical, Therapeutics","San Diego, California, United States",HemaQuest Pharmaceuticals develops small molecule therapeutics to treat anemia and other hemoglobin disorders.,info@hemaquest.com,858-356-5590,http://www.hemaquest.com,,4,Early Stage Venture,"$13,000,000 ",3/12/12,Series B,"$51,499,999 ","Biotechnology, Health Care, Science and Engineering",Private
Innovative Cellular Therapeutics,https://www.crunchbase.com/organization/innovative-cellular-therapeutics,Biotechnology,"Shanghai, Shanghai, China",A biotechnology company based in Shanghai.,,,,,1,Early Stage Venture,"$28,600,000 ",4/25/18,Series B,"$28,600,000 ","Biotechnology, Science and Engineering",Private
Solstice Biologics,https://www.crunchbase.com/organization/solstice-biologics,"Biotechnology, Medical, Therapeutics","San Francisco, California, United States",Solstice Biologics is a biotech company providing solutions for targeting and delivering nucleic acid therapeutics.,info@solsticebio.com,,http://www.solsticebio.com/,For Profit,5,Late Stage Venture,"$4,000,000 ",12/30/15,Series C,"$40,000,000 ","Biotechnology, Health Care, Science and Engineering",Private
Lutonix,https://www.crunchbase.com/organization/lutonix,"Biotechnology, Health Care, Medical Device","Maple Grove, Minnesota, United States","Lutonix DCB is a new drug-coated balloon catheter that delivers paclitaxel to the arterial wall in a single, short inflation.",info@lutonix.com,763-445-2352,http://www.lutonix.com,For Profit,3,M&A,"$10,000,001 ",12/13/10,Series C,"$35,000,001 ","Biotechnology, Health Care, Science and Engineering",Private
Venture Med Group,https://www.crunchbase.com/organization/venture-med-group,"Biotechnology, Medical, Medical Device","Sylvania, Ohio, United States","VMG designs, develops which enable interventionalists to cost effectively treat peripheral artery diseases.",info@venturemedgroup.com,(419) 725-1001,http://www.venturemedgroup.com/,For Profit,3,Early Stage Venture,"$15,000,000 ",8/15/17,Series B,"$15,000,000 ","Biotechnology, Health Care, Science and Engineering",Private
Diagnostic Photonics,https://www.crunchbase.com/organization/diagnostic-photonics,"Biotechnology, Health Diagnostics, Therapeutics","Chicago, Illinois, United States",Diagnostic Photonics develops advanced imaging technology that physicians can use in evaluating tissue microstructure in real time.,asomera@diagnosticphotonics.com,(312)854-9216,http://diagnosticphotonics.com,For Profit,4,Early Stage Venture,"$3,000,000 ",1/4/16,Series B,"$3,000,000 ","Biotechnology, Health Care, Science and Engineering",Private
PathoQuest,https://www.crunchbase.com/organization/pathoquest,Biotechnology,"Paris, Ile-de-France, France",A biotech company developing NGS-based metagenomic tests for exhaustive identification of pathogens in clinical testing and viral safety,contact@pathoquest.com,33170821790,https://www.pathoquest.com/,For Profit,2,Early Stage Venture,"$4,960,000 ",7/11/13,Series B,"$7,754,338 ","Biotechnology, Science and Engineering",Private
Acesion Pharma,https://www.crunchbase.com/organization/acesion-pharma,Biotechnology,"Copenhagen, Hovedstaden, Denmark",Acesion Pharma is a Danish biotech company aiming for developing more efficacious and safer drugs for the medical treatment of atrial,contact@acesionpharma.com,45 44 64 08 76,http://acesionpharma.com,,6,Late Stage Venture,"€9,100,000",11/3/16,Series C,"$20,263,458 ","Biotechnology, Science and Engineering",Private
Ingram Medical,https://www.crunchbase.com/organization/ingram-medical,"Biotechnology, Health Care, Medical Device","Sandy, Utah, United States","Ingram Medical improves the management of diabetes by providing quality testing supplies, oral medications and shipping services.",info@ingrammed.com,(877)215-0452,http://www.ingrammedical.com,For Profit,1,Early Stage Venture,"$30,000,000 ",9/5/13,Series B,"$30,000,000 ","Biotechnology, Health Care, Science and Engineering",Private
MerLion Pharma,https://www.crunchbase.com/organization/merlion-pharmaceuticals,"Biotechnology, Pharmaceutical","Singapore, Central Region, Singapore",MerLion Pharmaceuticals is a drug discovery and development company that researches and develops natural products.,enquiry@merlionpharma.com,(65) 66928002,http://www.merlionpharma.com,For Profit,3,Late Stage Venture,"$7,000,000 ",10/11/10,Series C,"$50,500,000 ","Biotechnology, Health Care, Science and Engineering",Private
Spinifex Pharmaceuticals,https://www.crunchbase.com/organization/spinifex-pharmaceuticals,"Biotechnology, Health Care, Pharmaceutical","Preston, Lancashire, United Kingdom",Spinifex Pharmaceuticals is a clinical-stage biotechnology company specializing in the development of products for the treatment of pain.,info@spinifexpharma.com.au,61399381205,http://www.spinifexpharma.com.au,For Profit,2,M&A,"$45,000,000 ",4/10/14,Series C,"$64,000,000 ","Biotechnology, Health Care, Science and Engineering",Private
AB2 Bio,https://www.crunchbase.com/organization/ab2-bio,"Biotechnology, Health Care, Medical, Therapeutics","Lausanne, Vaud, Switzerland",AB2 Bio is a drug discovery and development company.,info@ab2bio.com,41216938280,http://www.ab2bio.com/,For Profit,1,Early Stage Venture,"CHF21,000,000",1/14/16,Series B,"CHF21,000,000","Biotechnology, Health Care, Science and Engineering",Private
Pharma Two B,https://www.crunchbase.com/organization/pharma-two-b,Biotechnology,"Rehovot, HaMerkaz, Israel","Pharma Two B develops clinical products based on approved drugs, focusing on fixed-dose-combinations of two or more drugs for PD and cancer.",,972 8 947 2672,http://www.pharma2b.com,,2,Late Stage Venture,"$30,000,000 ",2/27/17,Series C,"$38,000,000 ","Biotechnology, Science and Engineering",Private
HandyLab,https://www.crunchbase.com/organization/handylab,"Biotechnology, Clinical Trials, Health Diagnostics","Ann Arbor, Michigan, United States",HandyLab is a business that provides the world with research into medical technology.,,734-663-4719,http://www.handylab.com,,6,M&A,"$19,200,000 ",8/5/08,Series D,"$33,154,000 ","Biotechnology, Health Care, Science and Engineering",Private
"Interface Biologics, Inc.",https://www.crunchbase.com/organization/interface-biologics,"Biotechnology, Health Care, Medical Device","Toronto, Ontario, Canada",Interface Biologics develops transformative biomedical polymer technology to improve the safety and effectiveness of medical devices.,information@interfacebiologics.com,4169771329,http://www.interfacebiologics.com,,5,Early Stage Venture,,1/13/15,Series B,"$32,000,000 ","Biotechnology, Health Care, Science and Engineering",Private
Oxyrane UK,https://www.crunchbase.com/organization/oxyrane-uk,"Biopharma, Biotechnology, Pharmaceutical","Manchester, Manchester, United Kingdom",Oxyrane UK is a biopharmaceutical company developing biosuperior enzyme replacement therapies to treat inherited diseases.,info@oxyrane.com,44 1612 326 000,http://www.oxyrane.com,,1,Late Stage Venture,"$26,500,000 ",11/17/11,Series D,"$26,500,000 ","Biotechnology, Health Care, Science and Engineering",Private
Synchroneuron,https://www.crunchbase.com/organization/synchroneuron,"Biotechnology, Health Care, Pharmaceutical","Newton, Massachusetts, United States",Synchroneuron is a biopharmaceutical company developing therapies for tardive dyskinesia and other related movement disorders.,,617-538-5688,http://synchroneuron.com,,2,Early Stage Venture,"$20,000,000 ",7/2/14,Series B,"$26,000,000 ","Biotechnology, Health Care, Science and Engineering",Private
Tethys BioScience,https://www.crunchbase.com/organization/tethys-bioscience,"Biotechnology, Health Care, Health Diagnostics","Emeryville, California, United States",Tethys BioScience develops and commercializes biological markers for use in the diagnosis of metabolic diseases.,info@tethysbio.com,510-420-6700,http://www.tethysbio.com,For Profit,3,Late Stage Venture,"$25,000,000 ",11/9/09,Series D,"$30,400,000 ","Biotechnology, Health Care, Science and Engineering",Private
Hookipa Biotech AG,https://www.crunchbase.com/organization/hookipa-biotech,Biotechnology,"Vienna, Wien, Austria",Hookipa is a clinical stage biotech company developing best-in-class active immunization therapies for infectious diseases and oncology.,office@hookipabiotech.com,+43 1 890 63 60,http://hookipabiotech.com,For Profit,4,Late Stage Venture,"$60,000,000 ",12/11/17,Series C,"$101,220,529 ","Biotechnology, Science and Engineering",Private
ZeaKal,https://www.crunchbase.com/organization/zeakal,"Biotechnology, Incubators","San Diego, California, United States",Zeakal is a plant science company developing technology to vastly increase the yield and oil content of multiple crops.,info@ZeaKal.com,(858)876-4682,http://www.zeakal.com,For Profit,2,Early Stage Venture,"$5,300,000 ",2/17/16,Series B,"$9,100,000 ","Biotechnology, Financial Services, Lending and Investments, Science and Engineering",Private
Selexys Pharmaceuticals Corporation,https://www.crunchbase.com/organization/selexys-pharmaceuticals-corporation,"Biotechnology, Health Care, Medical Device","Oklahoma City, Oklahoma, United States",Selexys Pharmaceuticals is a company focused on developing drugs to treat inflammatory and thrombotic diseases.,info@selexys.com,(405) 319-8195,http://www.selexys.com,For Profit,4,M&A,"$43,196,831 ",2/23/15,Series B,"$74,631,831 ","Biotechnology, Health Care, Science and Engineering",Private
CryoTherapeutics,https://www.crunchbase.com/organization/cryotherapeutics,Biotechnology,"Potsdam, Brandenburg, Germany","CryoTherapeutics is focusing on the development, demonstration of clinical benefit, and early-stage commercialization of a proprietary",info@cryotherapeutics.com,49 331 2300920,http://www.cryotherapeutics.com,For Profit,3,Early Stage Venture,"€5,200,000",7/7/16,Series B,"€11,700,000","Biotechnology, Science and Engineering",Private
Artax Biopharma,https://www.crunchbase.com/organization/artax-biopharma,"Biopharma, Biotechnology, Therapeutics","Cambridge, Massachusetts, United States",Artax Biopharma is a biopharmaceutical company developing new therapies for autoimmune and inflammatory diseases.,,617-401-2168,http://artaxbiopharma.com,,3,Early Stage Venture,"$10,000,000 ",9/22/15,Series B,"$13,276,082 ","Biotechnology, Health Care, Science and Engineering",Private
Vascular Pharmaceuticals,https://www.crunchbase.com/organization/vascular-pharmaceuticals,"Biotechnology, Diabetes, Health Care","Tarboro, North Carolina, United States",Vascular Pharmaceuticals is a drug discovery company developing monoclonal antibody treatments for diabetic nephropathy.,office@vascularpharma.com,919-345-7933,http://www.vascularpharma.com,,4,Early Stage Venture,"$3,000,000 ",1/7/16,Series B,"$29,000,000 ","Biotechnology, Health Care, Science and Engineering",Private
ImpactRx,https://www.crunchbase.com/organization/impactrx,"Biotechnology, Pharmaceutical, Therapeutics","Mount Laurel, New Jersey, United States",ImpactRx operates as a promotion research organization for the pharmaceutical industry in the United States.,info@impactrx.com,856-273-0221,http://www.impactrx.com,,3,M&A,"$1,200,000 ",1/11/10,Series E,"$4,200,000 ","Biotechnology, Health Care, Science and Engineering",Private
Microvi Biotechnologies,https://www.crunchbase.com/organization/microvi-biotechnologies,"Biotechnology, GreenTech, Water","Hayward, California, United States","Microvi Biotechnologies develops, manufactures, and commercializes biocatalytic technologies in the water, energy and chemical industries.",info@microvibiotech.com,(510) 344-0668,http://www.microvi.com,For Profit,4,Early Stage Venture,,1/15/15,Series B,"$6,500,000 ","Biotechnology, Natural Resources, Science and Engineering, Sustainability",Private
Calibra Medical,https://www.crunchbase.com/organization/calibra-medical,"Biotechnology, Diabetes, Health Care","Redwood City, California, United States",Calibra is a medical device company developing a wearable three-day insulin patch designed to treat diabetics.,,,,,6,M&A,"$8,100,000 ",4/15/11,Series D,"$63,400,000 ","Biotechnology, Health Care, Science and Engineering",Private
Cybrexa Therapeutics,https://www.crunchbase.com/organization/cybrexa-therapeutics,Biotechnology,"New Haven, Connecticut, United States","A New Haven, CT-based cancer therapeutics company.",,(860)717-2731,https://cybrexa.com,For Profit,1,Early Stage Venture,"$6,000,000 ",6/16/17,Series B,"$6,000,000 ","Biotechnology, Science and Engineering",Private
Incline Therapeutics,https://www.crunchbase.com/organization/incline-therapeutics,"Biotechnology, Medical, Medical Device, Therapeutics","Redwood City, California, United States",Incline Therapeutics is a hospital-focused specialty pharmaceutical company developing IONSYS for the treatment of post-operative pain.,krishna.gorti@themedco.com,650-241-6800,http://inclinethera.com,For Profit,3,M&A,"$21,500,000 ",9/28/11,Series B,"$64,940,000 ","Biotechnology, Health Care, Science and Engineering",Private
Grid Therapeutics,https://www.crunchbase.com/organization/grid-therapeutics,Biotechnology,"Durham, North Carolina, United States",A biotechnology company.,info@gridthr.com,919-987-7190,https://gridtherapeutics.com/,For Profit,2,Early Stage Venture,"$5,000,000 ",3/27/18,Series B,"$5,000,000 ","Biotechnology, Science and Engineering",Private
Kindstar Global (Beijing) Medicine Technology,https://www.crunchbase.com/organization/kindstar-global-beijing-medicine-technology,"Biotechnology, Hospital, Medical","Beijing, Beijing, China",Kindstar Global Medicine Technology is a Chinese high-tech enterprise that provides specialized inspection services for hospitals.,,400-736-1666,http://www.kindstar.com.cn/kindstar/cn/,For Profit,3,Late Stage Venture,"$20,000,000 ",3/1/12,Series C,"$31,000,000 ","Biotechnology, Health Care, Science and Engineering",Private
NewBridge Pharmaceuticals,https://www.crunchbase.com/organization/newbridge-pharmaceuticals,"Biotechnology, Medical Device, Pharmaceutical","Dubai, Dubai, United Arab Emirates",Newbridge Pharmaceuticals is a pharmaceutical and medical device company engaged in developing oncology and supportive care products.,info@nbpharma.com,971 44298700,http://www.nbpharma.com,,1,Early Stage Venture,"$12,000,000 ",9/20/10,Series B,"$12,000,000 ","Biotechnology, Health Care, Science and Engineering",Private
Synosia Therapeutics,https://www.crunchbase.com/organization/synosia-therapeutics,"Biotechnology, Medical, Therapeutics","Basel, Basel-Stadt, Switzerland",Synosia Therapeutics develops and commercializes products for unmet medical needs in psychiatry and neurology.,julie.walters@tudor-reilly.com,,http://www.synosia.com,For Profit,4,M&A,"$30,000,000 ",10/12/10,Series C,"$94,000,000 ","Biotechnology, Health Care, Science and Engineering",Private
Amazentis ,https://www.crunchbase.com/organization/amazentis,"Biotechnology, Health Care, Nutrition, Wellness","Lausanne, Vaud, Switzerland",Amazentis is an innovative life science company.,contact@amazentis.com,,http://www.amazentis.com,For Profit,1,Late Stage Venture,"CHF8,400,000",3/21/18,Series C,"CHF8,400,000","Biotechnology, Health Care, Science and Engineering",Private
Santen Pharmaceutical,https://www.crunchbase.com/organization/novagali-pharma,"Biotechnology, Manufacturing, Pharmaceutical","Emeryville, California, United States",Santen is a Japanese pharmaceutical company specializing in the development and manufacturing of ophthalmic products,contact@novagali.com,415-268-9100,http://www.santeninc.com/,For Profit,5,Late Stage Venture,"€15,000,000",9/26/09,Series D,"€59,000,000","Biotechnology, Health Care, Manufacturing, Science and Engineering",Private
Velomedix,https://www.crunchbase.com/organization/velomedix,"Biotechnology, Health Care","Menlo Park, California, United States","Velomedix, a therapeutic hypothermia company, offers solutions that protect the body’s organs during ischemic or inflammatory insults.",inquiry@velomedix.com,650-330-7314,http://www.velomedix.com,,3,Late Stage Venture,"$10,200,000 ",2/8/12,Series C,"$19,000,000 ","Biotechnology, Health Care, Science and Engineering",Private
Beijing Mabworks Biotech,https://www.crunchbase.com/organization/beijing-mabworks-biotech,Biotechnology,"Beijing, Beijing, China","Beijing Mabworks Biotech, a gene engineering mAb company.",,,http://www.mab-works.com/,For Profit,1,Early Stage Venture,"$39,000,000 ",1/25/17,Series B,"$39,000,000 ","Biotechnology, Science and Engineering",Private
REGiMMUNE Corporation,https://www.crunchbase.com/organization/regimmune-corporation,"Biopharma, Biotechnology, Health Diagnostics","Tokyo, Tokyo, Japan",REGiMMUNE is a biotechnology company producing immune-regulatory therapeutics for life-threatening diseases and debilitating disorders.,,81 3 6809 2199,http://www.regimmune.com,,7,Late Stage Venture,"$9,200,000 ",2/14/14,Series D,"$46,000,000 ","Biotechnology, Health Care, Science and Engineering",Private
Fe3 Medical,https://www.crunchbase.com/organization/fe3-medical,"Biotechnology, Health Care, Medical","San Jose, California, United States",Fe3 Medical develops a drug delivery technology for non-toxic iron transportation across the skin for patients with iron-deficiency anemia.,,(408)457-3712,http://fe3medical.com,For Profit,5,Early Stage Venture,"$3,500,000 ",8/8/16,Series B,"$22,709,458 ","Biotechnology, Health Care, Science and Engineering",Private
Cardiorentis ,https://www.crunchbase.com/organization/cardiorentis,"Biopharma, Biotechnology, Health Care","Zug, Zug, Switzerland",Cardiorentis is a privately owned biopharmaceutical company.,info@cardiorentis.com,+41 41 748 60 30,http://www.cardiorentis.com,For Profit,2,Early Stage Venture,"CHF60,000,000",1/10/16,Series B,"$118,481,579 ","Biotechnology, Health Care, Science and Engineering",Private
Regentis Biomaterials,https://www.crunchbase.com/organization/regentis-biomaterials,"Biotechnology, Health Care, Medical Device","Or Akiva, Hefa, Israel",Regentis Biomaterials develops and commercializes proprietary hydrogels for tissue regeneration.,info@regentis.co.il,97248546644,http://www.regentis.co.il,For Profit,4,Late Stage Venture,"$15,000,000 ",2/7/16,Series D,"$32,500,000 ","Biotechnology, Health Care, Science and Engineering",Private
Follica,https://www.crunchbase.com/organization/follica,"Biotechnology, Health Care, Therapeutics","Mendham, New Jersey, United States",Follica develops novel therapies for conditions and disorders of the hair follicle.,info@follicabio.com,617-482-2333,http://www.follicabio.com,,4,Early Stage Venture,"$134,999 ",11/8/10,Series B,"$24,134,998 ","Biotechnology, Health Care, Science and Engineering",Private
SciFluor Life Sciences,https://www.crunchbase.com/organization/scifluor-life-sciences,"Biotechnology, Health Care, Medical","Boston, Massachusetts, United States",SciFluor Life Sciences develops fluorination technologies that improve drug properties such as metabolic stability and potency.,,(617) 684-4748,http://www.scifluor.com,For Profit,2,Early Stage Venture,"$30,000,000 ",4/21/15,Series B,"$35,000,000 ","Biotechnology, Health Care, Science and Engineering",Private
Humedics,https://www.crunchbase.com/organization/humedics,Biotechnology,"Berlin, Berlin, Germany","Humedics GmbH, a Berlin, Germany-based specialist for mobile measurement of liver function.",info@humedics.de,49 30 5 90 08 32 40,http://www.humedics.de,For Profit,3,Late Stage Venture,"€6,300,000",11/10/14,Series C,"€6,800,000","Biotechnology, Science and Engineering",Private
Phagenesis,https://www.crunchbase.com/organization/phagenesis,"Biotechnology, Health Care, Medical","Manchester, Manchester, United Kingdom","Phagenesis is engaged in the development of a device to treat dysphagia, a condition that disables the safe swallowing of food.",contact@phagenesis.com,+44 161 820 4525,http://www.phagenesis.com,,3,M&A,"$17,000,000 ",5/22/13,Series B,"$29,396,967 ","Biotechnology, Health Care, Science and Engineering",Private
BridgePoint Medical,https://www.crunchbase.com/organization/bridgepoint-medical,"Biotechnology, Health Care, Medical","Plymouth, Minnesota, United States",BridgePoint develops proprietary technology for the treatment of chronic total occlusions.,,763-225-8500,http://www.bridgepointmedical.com,,6,M&A,"$9,100,000 ",3/25/11,Series C,"$36,301,007 ","Biotechnology, Health Care, Science and Engineering",Private
SARcode Bioscience,https://www.crunchbase.com/organization/sarcode-corporation,"Biotechnology, Health Care, Health Diagnostics","Brisbane, California, United States","SARcode Bioscience develops an antigen for the treatment of unmet medical needs in ophthalmology, dermatology and inflammatory diseases.",SARcode@sarcode.com,650-416-7560,http://www.sarcode.com,,3,M&A,"$44,000,000 ",7/18/11,Series B,"$98,000,000 ","Biotechnology, Health Care, Science and Engineering",Private
CinRx Pharma,https://www.crunchbase.com/organization/cinrx-pharma,"Biotechnology, Pharmaceutical","Cincinnati, Ohio, United States",A new approach to biopharmaceutical development.,info@cinrx.com, 844-531-1834,http://www.cinrx.com,,2,Early Stage Venture,"$10,000,000 ",11/28/17,Series B,"$38,406,731 ","Biotechnology, Health Care, Science and Engineering",Private
Harbor MedTech,https://www.crunchbase.com/organization/harbor-medtech,"Biotechnology, Life Science, Medical","Irvine, California, United States","Harbor MedTech develops and commercializes tissue regeneration products for chronic wounds, hernia and joint repair, and more.",Support@harbormedtech.com,9496791086,http://harbormedtech.com,,6,Late Stage Venture,,9/5/17,Series C,"$9,271,733 ","Biotechnology, Health Care, Science and Engineering",Private
SuppreMol,https://www.crunchbase.com/organization/suppremol,"Biotechnology, Health Care, Medical Device","Munich, Bayern, Germany",SuppreMol is a biotechnology company developing treatment of autoimmune diseases leading to the cure of such disorders.,info@suppremol.com,49 89 30 90 50 680,http://www.suppremol.com,,5,M&A,"€16,000,000",5/29/13,Series D,"$83,508,009 ","Biotechnology, Health Care, Science and Engineering",Private
apceth Biopharma,https://www.crunchbase.com/organization/apceth-biopharma,"Biotechnology, Genetics","Munich, Bayern, Germany",apceth Biopharma dedicated to the development and clinical implementation of innovative cell and gene therapeutics.,contact@apceth.com,4.90897E+12,http://www.apceth.com/,For Profit,2,Early Stage Venture,"€4,700,000",2/4/13,Series B,"€4,700,000","Biotechnology, Health Care, Science and Engineering",Private
