Stratos Genomics,https://www.crunchbase.com/organization/stratos-genomics,"Biotechnology, Genetics, Medical Device, Product Design","Seattle, Washington, United States","Stratos Genomics develops Sequencing by Expansion (SBX™), a single-molecule detection process that enables whole genome sequencing.",mkokoris@stratosgenomics.com,206-448-7961,http://www.stratosgenomics.com,,8,Early Stage Venture,"$20,000,000 ",1/8/18,Series B,"$55,929,000 ","Biotechnology, Design, Health Care, Science and Engineering",Private
Applied StemCell,https://www.crunchbase.com/organization/applied-stemcell,"Biotechnology, Genetics, Health Diagnostics, Medical","Milpitas, California, United States",Applied StemCell is a biotechnology company providing animal and cell line models as tools for drug discovery and diagnostics.,info@appliedstemcell.com,1.14088E+11,http://www.appliedstemcell.com,For Profit,4,Late Stage Venture,"$19,000,000 ",6/6/16,Series D,"$23,520,763 ","Biotechnology, Health Care, Science and Engineering",Private
Millendo Therapeutics,https://www.crunchbase.com/organization/atterocor,"Biotechnology, Life Science, Therapeutics","Ann Arbor, Michigan, United States",Atterocor focuses on research and development of therapeutics for adrenal disease.,careers@millendo.com,7348459000,http://www.millendo.com/,For Profit,3,Early Stage Venture,"$62,000,000 ",1/5/16,Series B,"$86,522,872 ","Biotechnology, Health Care, Science and Engineering",Private
Proclara Biosciences,https://www.crunchbase.com/organization/neurophage-pharmaceuticals,"Biotechnology, Life Science, Therapeutics","Cambridge, Massachusetts, United States",Proclara is pioneering a new approach to treating neurodegenerative diseases.,info@neurophage.com,1(617) 714-5468,http://www.proclarabio.com/,For Profit,7,Late Stage Venture,"$47,000,000 ",9/7/16,Series E,"$108,800,000 ","Biotechnology, Health Care, Science and Engineering",Private
"Delphinus Medical Technologies, Inc.",https://www.crunchbase.com/organization/delphinus-medical-technologies,"Biotechnology, Health Care, Medical, Medical Device","Plymouth, Michigan, United States","Delphinus Medical Technologies develops, commercializes, and services breast cancer screening solutions to hospitals and imaging clinics.",,734-233-3088,http://www.delphinusmt.com,For Profit,4,Late Stage Venture,"$8,229,049 ",4/20/17,Series C,"$66,729,049 ","Biotechnology, Health Care, Science and Engineering",Private
Lasergen,https://www.crunchbase.com/organization/lasergen,"Biotechnology, Genetics, Health Care, Health Diagnostics","Houston, Texas, United States",Lasergen is a biotechnology company developing and commercializing technologies for genomic applications.,mmetzker@lasergen.com,7137473390,http://lasergen.com,For Profit,2,M&A,"$80,000,000 ",3/7/16,Series B,"$85,000,000 ","Biotechnology, Health Care, Science and Engineering",Private
AccuraGen Holdings,https://www.crunchbase.com/organization/accuragen-holdings,"Biotechnology, Health Care, Medical Device","Menlo Park, California, United States",A US-China cancer diagnostics company,,1.16506E+11,http://www.accuragen.com,For Profit,2,Early Stage Venture,"$40,000,000 ",6/1/16,Series B,"$40,000,000 ","Biotechnology, Health Care, Science and Engineering",Private
Tendyne Holdings,https://www.crunchbase.com/organization/tendyne-holdings,"Biotechnology, Clinical Trials, Medical Device","Rockville, Minnesota, United States",Tendyne is a medical device company developing a transcatheter aortic valve implantation system.,info@tendyne.com,651-289-5500,http://www.tendyne.com,,3,M&A,"$25,000,000 ",4/9/14,Series C,"$37,476,197 ","Biotechnology, Health Care, Science and Engineering",Private
CytoVale,https://www.crunchbase.com/organization/cytovale,"Analytics, Biotechnology, Life Science","South San Francisco, California, United States","Categorized under Analytical Instruments, our records show it was established in and incorporated in Massachusetts, current estimates show",info@cytovale.com,5628816919,http://www.cytovale.com/,,3,Early Stage Venture,"$7,249,989 ",12/22/17,Series B,"$11,549,989 ","Biotechnology, Data and Analytics, Science and Engineering",Private
EIP Pharma,https://www.crunchbase.com/organization/eip-pharma,"Biopharma, Biotechnology, Pharmaceutical","Cambridge, Massachusetts, United States","EIP Pharma, is a private company that has licensed-in and is developing neflamapimod.",jalam@eippharma.com,,http://www.eippharma.com/,,2,Early Stage Venture,"$20,500,000 ",5/16/18,Series B,"$20,900,000 ","Biotechnology, Health Care, Science and Engineering",Private
CeQur,https://www.crunchbase.com/organization/cequr,"Biotechnology, Diabetes, Medical Device","Horw, Luzern, Switzerland","CeQur develops and commercializes insulin delivery systems, giving people with type 2 diabetes freedom from multiple daily injections.",info@cequr.com,41415004862,http://www.cequrcorp.com,For Profit,3,Late Stage Venture,"$100,000,000 ",9/1/15,Series C,"$156,600,000 ","Biotechnology, Health Care, Science and Engineering",Private
Knome,https://www.crunchbase.com/organization/knome,"Biotechnology, Genetics, Health Care, Software","Cambridge, Massachusetts, United States",Knome provides human genome interpretation software and services for researchers investigating the genetic basis of rare diseases.,webmaster@knome.com,617-941-4130,http://www.knome.com,,4,M&A,"$13,000,000 ",1/21/14,Series D,"$28,800,000 ","Biotechnology, Health Care, Science and Engineering, Software",Private
IsoPlexis,https://www.crunchbase.com/organization/isoplexis,"Biotechnology, Medical Device, Therapeutics","Branford, Connecticut, United States","IsoPlexis is a life sciences company developing an innovative, single-cell, protein response analysis platform.",info@isoplexis.com,,http://isoplexis.com/,For Profit,4,Early Stage Venture,"$13,500,000 ",9/25/17,Series B,"$15,150,000 ","Biotechnology, Health Care, Science and Engineering",Private
MobileODT,https://www.crunchbase.com/organization/mobileoct,"Biotechnology, Health Care, Medical Device","Tel Aviv, Tel Aviv, Israel",MobileODT uses mobile phones to detect cancer and other diseases.,info@mobileodt.com,+972 52-432-7686,http://www.mobileodt.com/,For Profit,3,Early Stage Venture,"$6,850,000 ",7/5/17,Series B,"$9,850,000 ","Biotechnology, Health Care, Science and Engineering",Private
Navigenics,https://www.crunchbase.com/organization/navigenics,"Biotechnology, Genetics, Health Care, Pet","Foster City, California, United States",Navigenics is a personal genomics company that uses genetic testing to help people determine their individual risk for health conditions.,memberservice@navigenics.com,(800)917-6090,http://www.navigenics.com,For Profit,2,M&A,"$18,000,000 ",2/4/10,Series C,"$43,000,000 ","Biotechnology, Community and Lifestyle, Health Care, Science and Engineering",Private
Novogene Corporation,https://www.crunchbase.com/organization/novogene-corporation,"Bioinformatics, Biotechnology, Education","Haidian, Beijing, China",It is a leading provider of genomic services and solutions with cutting edge NGS,support@novogene.com,(877)230-9060,https://en.novogene.com/,For Profit,1,Early Stage Venture,"CN¥515,000,000",11/30/16,Series B,"CN¥515,000,000","Biotechnology, Data and Analytics, Education, Science and Engineering",Private
"Pronutria Biosciences, Inc.",https://www.crunchbase.com/organization/pronutria,"Biotechnology, Life Science, Therapeutics","Cambridge, Massachusetts, United States",Pronutria Biosciences is developing new nutritional and therapeutic modalities: amino acid biologics.,info@pronutriabio.com,(617) 868-0949,http://pronutriabio.com,For Profit,4,Late Stage Venture,"$42,500,000 ",2/23/16,Series D,"$92,300,000 ","Biotechnology, Health Care, Science and Engineering",Private
AltheaDx,https://www.crunchbase.com/organization/altheadx,"Biotechnology, Clinical Trials, Genetics, Health Diagnostics","San Diego, California, United States","AltheaDx offers molecular diagnostics and PCR-based services such as molecular biomarker discovery, assay development and assay validation.",sales@altheadx.com,1(855)697-4943,http://altheadx.com,For Profit,6,Late Stage Venture,"$27,000,000 ",4/25/17,Series D,"$73,974,363 ","Biotechnology, Health Care, Science and Engineering",Private
Symic Biomedical,https://www.crunchbase.com/organization/symic-biomedical,"Biotechnology, Business Intelligence, Health Care","Emeryville, California, United States","SYMIC Biomedical, Inc. operates in the healthcare industry focusing on biotechnology business. The company studies treatments for",info@symicbio.com,1(415) 805-9005,http://www.symicbio.com/contact/,For Profit,5,Early Stage Venture,"$30,000,000 ",5/22/17,Series B,"$72,875,687 ","Biotechnology, Data and Analytics, Health Care, Science and Engineering",Private
Green Biologics,https://www.crunchbase.com/organization/green-biologics,"Biotechnology, Chemical, Chemical Engineering","Abingdon, Oxfordshire, United Kingdom",Green Biologics offers fermentation technologies for the conversion of biomass to renewable fuels and chemicals.,info@greenbiologics.com,44 12 3543 5710,http://www.greenbiologics.com,,8,Late Stage Venture,"$42,000,000 ",1/21/15,Series C,"$120,110,515 ","Biotechnology, Science and Engineering",Private
HealthTell,https://www.crunchbase.com/organization/healthtell,"Biotechnology, Health Care, Health Diagnostics, Personal Health","San Ramon, California, United States",HealthTell provides the most accurate and affordable diagnostic platform for early detection and classification of complex diseases.,info@healthtell.com,(925) 361-3115,http://www.healthtell.com,For Profit,4,Early Stage Venture,"$26,098,829 ",3/9/16,Series B,"$44,782,168 ","Biotechnology, Health Care, Science and Engineering",Private
US HealthVest,https://www.crunchbase.com/organization/us-healthvest,"Biotechnology, Health Care, Hospital","New York, New York, United States",US HealthVest is a behavioral healthcare firm that helps the development of psychiatric hospitals.,,(212)243-5565,http://www.ushealthvest.com,For Profit,2,Early Stage Venture,"$50,000,000 ",6/30/16,Series B,"$86,000,000 ","Biotechnology, Health Care, Science and Engineering",Private
Iconic Therapeutics,https://www.crunchbase.com/organization/iconic-therapeutics,"Biopharma, Biotechnology, Therapeutics","Atlanta, Georgia, United States",Iconic Therapeutics develops and commercializes immunoconjugate proteins that trigger the immune system to destroy invader cells.,,404-522-8577,http://www.iconictherapeutics.com,For Profit,7,Late Stage Venture,"$10,000,000 ",8/9/16,Series C,"$78,391,902 ","Biotechnology, Health Care, Science and Engineering",Private
Channel Medsystems,https://www.crunchbase.com/organization/channel-medsystems,"Biotechnology, Health Care, Women's","San Francisco, California, United States",Channel Medystems is engaged in the development of proprietary cryo-ablation delivery technologies.,info@channelmedsystems.com,415-546-0204,http://channelmedsystems.com,,6,Late Stage Venture,"$14,100,000 ",8/23/17,Series C,"$52,887,000 ","Biotechnology, Health Care, Science and Engineering",Private
NBE-Therapeutics,https://www.crunchbase.com/organization/nbe-therapeutics,"Biotechnology, Medical, Therapeutics","Basel, Basel-Stadt, Switzerland","NBE-Therapeutics is a privately owned Swiss, Basel-based Biotech company.",info@NBE-Therapeutics.com,41616332230,http://www.nbe-therapeutics.com,For Profit,3,Early Stage Venture,"CHF20,000,000",6/28/18,Series B,"CHF43,000,000","Biotechnology, Health Care, Science and Engineering",Private
MicuRx Pharmaceuticals,https://www.crunchbase.com/organization/micurx-pharmaceuticals,"Biotechnology, Health Care, Medical","Hayward, California, United States",MicuRx discovers and develops novel antibiotics to prevent and treat drug-resistant bacterial infections.,zyuan@micurx.com,510-782-2021,http://micurx.com,,4,Late Stage Venture,"CN¥100,000,000",12/7/17,Series D,"$105,106,196 ","Biotechnology, Health Care, Science and Engineering",Private
Galera Therapeutics,https://www.crunchbase.com/organization/galera-therapeutics,"Biotechnology, Life Science, Therapeutics","Malvern, Pennsylvania, United States",Galera Therapeutics develops therapeutic agents for preventing damage to normal tissues during the radiation treatment of cancer.,,6104080321,http://www.galeratx.com,,8,Early Stage Venture,"$15,000,000 ",11/28/16,Series B,"$78,610,000 ","Biotechnology, Health Care, Science and Engineering",Private
Vivace Therapeutics,https://www.crunchbase.com/organization/vivace-therapeutics,"Biotechnology, Medical, Therapeutics","San Mateo, California, United States",A venture-backed start-up dedicated to discovering and developing cancer therapeutics by targeting a novel pathway.,Info@vivacetherapeutics.com,,http://vivacetherapeutics.com,For Profit,2,Early Stage Venture,"$25,000,000 ",6/28/17,Series B,"$40,000,000 ","Biotechnology, Health Care, Science and Engineering",Private
Adarza BioSystems,https://www.crunchbase.com/organization/adarza-biosystems,"Biotechnology, Clinical Trials, Health Diagnostics","St Louis, Missouri, United States",Adarza BioSystems develops a biological assay platform for measuring clinical and point-of-care samples.,info@adarzabio.com,(585) 292-7870,http://www.adarzabio.com,For Profit,6,Late Stage Venture,"$17,000,000 ",1/19/17,Series C,"$31,050,000 ","Biotechnology, Health Care, Science and Engineering",Private
Nurix,https://www.crunchbase.com/organization/nurix,"Biotechnology, Health Care, Therapeutics","San Francisco, California, United States",Nurix develops small molecule inhibitors for the treatment of proliferative and degenerative diseases.,info@nurix-inc.com,415-865-2057,http://nurix-inc.com,For Profit,3,Late Stage Venture,"$17,000,000 ",9/25/15,Series C,"$45,200,000 ","Biotechnology, Health Care, Science and Engineering",Private
LAM Therapeutics,https://www.crunchbase.com/organization/lam-therapeutics,"Biotechnology, Genetics, Medical, Therapeutics","Guilford, Connecticut, United States",LAM Therapeutics develops drugs for rare diseases and cancer.,info@lamthera.com,(203)458-7100,http://lamtherapeutics.com/,For Profit,2,Late Stage Venture,"$58,000,000 ",3/30/17,Series C,"$98,000,000 ","Biotechnology, Health Care, Science and Engineering",Private
PanOptica,https://www.crunchbase.com/organization/panoptica,"Biopharma, Biotechnology, Therapeutics","Mount Arlington, New Jersey, United States",PanOptica is a biopharma company developing ophthalmic therapeutics for the treatment of eye diseases.,info@panopticapharma.com,908-766-2202,http://panopticapharma.com,For Profit,5,Early Stage Venture,"$11,000,000 ",10/6/17,Series B,"$109,883,195 ","Biotechnology, Health Care, Science and Engineering",Private
Crown Bioscience,https://www.crunchbase.com/organization/crown-bioscience,"Biotechnology, Health Care, Medical","Santa Clara, California, United States",Crown Bioscience provides drug discovery solutions to pharmaceutical companies for cancer and metabolic diseases.,busdev@crownbio.com.,(855)827-6968,http://www.crownbio.com,For Profit,7,M&A,"$26,600,000 ",5/23/14,Series D,"$88,650,000 ","Biotechnology, Health Care, Science and Engineering",Private
Acousia Therapeutics,https://www.crunchbase.com/organization/acousia-therapeutics,"Biotechnology, Health Care, Therapeutics","Tübingen, Baden-Wurttemberg, Germany",Acousia Therapeutics is working to prevent and treat hearing loss by inhibiting cell apoptosis and encouraging cell regeneration.,info@acousia.com,,http://www.acousia.com/,For Profit,2,Early Stage Venture,"€10,000,000",5/14/18,Series B,"€12,500,000","Biotechnology, Health Care, Science and Engineering",Private
MedDay,https://www.crunchbase.com/organization/medday,"Biotechnology, Medical, Pharmaceutical","Paris, Ile-de-France, France",MedDay is a biotechnology company specializing in therapeutics for the treatment of neuro-metabolic diseases.,contact@medday-pharma.com,,http://www.medday-pharma.com/,For Profit,2,Early Stage Venture,"$38,500,000 ",4/8/16,Series B,"$48,958,774 ","Biotechnology, Health Care, Science and Engineering",Private
Celtaxsys,https://www.crunchbase.com/organization/celtaxsys,"Biopharma, Biotechnology, Health Care","Atlanta, Georgia, United States","Celtaxsys is a biopharmaceutical company, engages in developing and testing drug compounds for treating cancer.",info@celtaxsys.com,(404) 920-0702,http://www.celtaxsys.com,For Profit,6,Late Stage Venture,,1/8/18,Series E,"$60,162,386 ","Biotechnology, Health Care, Science and Engineering",Private
Symetis,https://www.crunchbase.com/organization/symetis,"Biotechnology, Health Care, Medical","Ecublens, Vaud, Switzerland",Symetis is a Swiss company developing minimally invasive heart valve replacement therapies for patients suffering from heart valve diseases.,info@symetis.com,41216510160,http://www.symetis.com,For Profit,5,M&A,,5/3/12,Series D,"$56,700,000 ","Biotechnology, Health Care, Science and Engineering",Private
Amphora Medical,https://www.crunchbase.com/organization/amphora-medical,"Biotechnology, Manufacturing, Medical Device","Minneapolis, Minnesota, United States",Amphora Medical is a Minnesota-based developer of medical devices and instruments.,,7634961719,http://amphoramedical.com/,,3,Early Stage Venture,"$35,500,000 ",7/20/17,Series B,"$48,882,106 ","Biotechnology, Health Care, Manufacturing, Science and Engineering",Private
GnuBIO,https://www.crunchbase.com/organization/gnubio,"Biotechnology, Genetics, Health Care, Medical Device","Cambridge, Massachusetts, United States",GnuBIO is a developer of scalable DNA sequencing technology for the diagnostic and applied markets.,info@gnubio.com,617 446 6744,http://gnubio.com,For Profit,4,M&A,"$10,000,000 ",10/2/12,Series B,"$22,500,000 ","Biotechnology, Health Care, Science and Engineering",Private
Psioxus Therapeutics,https://www.crunchbase.com/organization/psioxus-therapeutics,"Biotechnology, Health Care, Therapeutics","Oxfordshire, United Kingdom, Europe",PsiOxus Therapeutics Ltd develops novel therapeutics for serious diseases with a particular focus upon cancer.,enquiries@psioxus.com,44 1235 835 328,http://www.psioxus.com/,For Profit,4,Late Stage Venture,"£25,000,000",5/19/15,Series C,"£52,600,000","Biotechnology, Health Care, Science and Engineering",Private
Annexon Biosciences,https://www.crunchbase.com/organization/annexon-biosciences,"Biotechnology, Health Care, Health Diagnostics, Life Science, Therapeutics","South San Francisco, California, United States","Annexon Biosciences a biotechnology company, discovers and developing novel therapeutics for neurodegenerative and autoimmune disorders.",info@annexonbio.com,(650)822-5500,http://www.annexonbio.com/contact/,For Profit,3,Early Stage Venture,"$44,000,000 ",6/23/16,Series B,"$78,999,999 ","Biotechnology, Health Care, Science and Engineering",Private
GrayBug,https://www.crunchbase.com/organization/graybug,"Biotechnology, Health Care, Medical","Baltimore, Maryland, United States",GrayBug is a biotechnology company developing technologies to treat eye diseases.,info@GrayBug.com,,http://graybug.com,For Profit,5,Early Stage Venture,"$44,500,000 ",5/2/16,Series B,"$49,240,000 ","Biotechnology, Health Care, Science and Engineering",Private
Oculis,https://www.crunchbase.com/organization/oculis,"Biotechnology, Health Care, Pharmaceutical","Reykjavík, Gullbringusysla, Iceland","Oculis is a clinical-stage, privately held, pharmaceutical development company focusing on ophthalmic drugs and novel drug delivery.",info@oculispharma.com,+354 546-4440,http://www.oculis.com,For Profit,7,Early Stage Venture,"CHF20,000,000",1/4/18,Series B,"$21,063,556 ","Biotechnology, Health Care, Science and Engineering",Private
MISSION Therapeutics,https://www.crunchbase.com/organization/mission-therapeutics,"Biotechnology, Health Care, Health Diagnostics","Cambridge, Cambridgeshire, United Kingdom",MISSION Therapeutics is a platform of technologies for the development of drugs targeting enzymes involved in cancer and other diseases.,enquires@missiontherapeutics.com,4.40122E+12,http://www.missiontherapeutics.com,For Profit,4,Late Stage Venture,"£60,000,000",2/2/16,Series C,"$127,572,919 ","Biotechnology, Health Care, Science and Engineering",Private
Carmot Therapeutics,https://www.crunchbase.com/organization/carmot-therapeutics,"Biotechnology, Health Care, Therapeutics","San Francisco, California, United States","Carmot Therapeutics develops drugs to treat inflammatory, metabolic and neurological diseases.",info@carmot.us,5105279251,http://carmot.us,,4,Early Stage Venture,"$15,000,000 ",1/17/18,Series B,"$27,846,101 ","Biotechnology, Health Care, Science and Engineering",Private
Applied Proteomics,https://www.crunchbase.com/organization/applied-proteomics,"Biotechnology, Health Care, Health Diagnostics","San Diego, California, United States",Applied Proteomics offers a protein biomarker discovery platform to advance the application of proteomics.,info@appliedproteomics.com,8589992800,http://www.appliedproteomics.com,,3,Late Stage Venture,"$28,000,000 ",8/20/13,Series C,"$54,500,000 ","Biotechnology, Health Care, Science and Engineering",Private
Avelas Biosciences,https://www.crunchbase.com/organization/avelas-biosciences,"Biotechnology, Life Science, Real Time","La Jolla, California, United States",Avelas Biosciences develops real-time luminous maps for oncologic surgeons to refer while in surgery.,info@avelasbio.com,8587504704,http://www.avelasbio.com,,4,Late Stage Venture,"$20,000,000 ",8/18/16,Series C,"$41,850,000 ","Biotechnology, Science and Engineering",Private
TruTag Technologies,https://www.crunchbase.com/organization/trutag-technologies,"AgTech, Biotechnology, Pharmaceutical, Product Management","Kapolei, Hawaii, United States","TruTag Technologies, Inc. provides product authentication and brand protection solutions.",info@trutags.com,8089492209,http://www.trutags.com/,,2,Early Stage Venture,,3/1/15,Series B,"$16,776,527 ","Agriculture and Farming, Biotechnology, Health Care, Science and Engineering",Private
Adagene,https://www.crunchbase.com/organization/adagene,"Biotechnology, Medical, Therapeutics","Suzhou, Jiangsu, China",Adagene is an antibody discovery and engineering company which seeks to establish technology-driven discovery partnerships.,info@adagene.com,51287773632,http://www.adagene.com/,For Profit,4,Late Stage Venture,"$50,000,000 ",3/27/18,Series C,"$86,000,000 ","Biotechnology, Health Care, Science and Engineering",Private
M3 Biotechnology,https://www.crunchbase.com/organization/m3-biotechnology,"Biotechnology, Therapeutics","Seattle, Washington, United States",M3 Biotechnology is a clinical-stage company with a novel platform of disease-modifying regenerative small molecules.,info@m3bio.com,206-221-8112,http://m3bio.com,For Profit,4,Early Stage Venture,"$15,200,000 ",11/2/17,Series B,"$30,100,000 ","Biotechnology, Health Care, Science and Engineering",Private
On Target Laboratories,https://www.crunchbase.com/organization/on-target-laboratories,"Biotechnology, Life Science, Medical","Northbrook, Illinois, United States","On Target Laboratories engages in discovering, developing, and commercializing small molecules that target specific pathological",,6105846191,http://www.ontargetlaboratories.com/,,4,Early Stage Venture,"$4,000,000 ",3/14/18,Series B,"$60,700,000 ","Biotechnology, Health Care, Science and Engineering",Private
Arbor Pharmaceuticals,https://www.crunchbase.com/organization/arbor-pharmaceuticals,"Biotechnology, Life Science, Pharmaceutical","Atlanta, Georgia, United States",Arbor Pharmaceuticals is a specialty pharmaceutical company developing late-stage therapeutic products for common pediatric conditions.,info@arborpharma.com,6783342423,http://www.arborpharma.com,For Profit,4,Early Stage Venture,"$34,800,000 ",11/11/10,Series B,"$40,436,000 ","Biotechnology, Health Care, Science and Engineering",Private
HaploX Biotechnology,https://www.crunchbase.com/organization/haplox-biotechnology,Biotechnology,"Shenzhen, Guangdong, China",HaploX Biotechnology is a Shenzhen-based genetic sequencing company. ,,,,,3,Early Stage Venture,,6/28/18,Series B,"$42,000,000 ","Biotechnology, Science and Engineering",Private
Lineagen,https://www.crunchbase.com/organization/lineagen,"Biotechnology, Genetics, Health Care, Health Diagnostics","Salt Lake City, Utah, United States","Lineagen provides genetic evaluation services in autism, developmental delay and other genetic disorders.",info@lineagen.com,8019316200,http://www.lineagen.com,,7,Late Stage Venture,"$12,170,000 ",1/26/15,Series C,"$60,964,064 ","Biotechnology, Health Care, Science and Engineering",Private
Teewinot Life Sciences,https://www.crunchbase.com/organization/teewinot-life-sciences,Biotechnology,"Tampa, Florida, United States",Teewinot Life Sciences Corporation is a biopharmaceutical company,contact@tlscorp.com,(813)501-5021,https://tlscorp.com/,For Profit,2,Early Stage Venture,"$12,300,000 ",5/1/17,Series B,"$19,300,000 ","Biotechnology, Science and Engineering",Private
Integrated Diagnostics,https://www.crunchbase.com/organization/integrated-diagnostics,"Biotechnology, Health Care, Health Diagnostics","Seattle, Washington, United States",Integrated Diagnostics develops tools to help physicians diagnose complex diseases with a non-invasive blood test.,info@indidx.com,206-576-6300,http://www.indidx.com,For Profit,8,Late Stage Venture,"$6,100,000 ",12/28/16,Series C,"$95,150,000 ","Biotechnology, Health Care, Science and Engineering",Private
Quantapore,https://www.crunchbase.com/organization/quantapore,"Biotechnology, Health Care, Medical","Menlo Park, California, United States",Quantapore is a biotech company developing nanopore-based nucleic acid sequencing technology.,,650-321-2030,http://www.quantapore.com/,,3,Late Stage Venture,,9/27/16,Series C,"$35,000,000 ","Biotechnology, Health Care, Science and Engineering",Private
